Game title;Amount of recommendations;Current price;Current discount;Genre;Publisher;Rating;Names;Collection;Release;engine;Platforms
Saints Row 2;7,534;$9.99;0;Shooter;CD Projekt;81.16666666666667;黑街聖徒2, Saints Row 3DS, SR2, Saint's Row 2, SR, SR, Saint's Row 2, SR2;Saints Row;05-01-2009;Havok;PC (Microsoft Windows), PlayStation 3, Xbox 360
Deponia;7,521;$3.99;-90%;Point-and-click;Daedalic Entertainment;80.0;Deponia 2, Chaos auf Deponia;Deponia;06-11-2012;Visionaire;Linux, PC (Microsoft Windows), Mac, PlayStation 4, Xbox One, Nintendo Switch
Natural Selection 2;7,513;$9.99;0;Shooter;Unknown Worlds Entertainment;85.0;Natural Selection II, Natural Selection 2;Natural Selection;30-10-2012;Spark;PC (Microsoft Windows)
The Mean Greens - Plastic Warfare;7,482;$9.99;0;Shooter;Virtual Basement LLC;40.0;The Mean Greens, ザミーングリーンエスプラスティクウォーフェアー;N/A;05-08-2020;Unreal Engine;PC (Microsoft Windows), PlayStation 4, Xbox One, Nintendo Switch
NARUTO SHIPPUDEN: Ultimate Ninja STORM 3 Full Burst;7,460;$7.99;-60%;Fighting;Namco Bandai Games;78.5;Naruto Shippuden: Ultimate Ninja Storm 3 Full Burst HD, ナルト 疾風伝　ナルティメットストーム３;Naruto: Ultimate Ninja;22-10-2013;N/A;PC (Microsoft Windows), PlayStation 3, Xbox 360, PlayStation 4, Xbox One, Nintendo Switch
FAR: Lone Sails;7,424;$14.99;0;Platform;Mixtvision;77.5;FAR, 파: 론 세일즈, ファ− : ローン・セイルズ;FAR;02-04-2019;Unity;PC (Microsoft Windows), Mac, Android, iOS, PlayStation 4, Xbox One, Nintendo Switch
Barotrauma;7,369;$14.99;-50%;Simulator;FakeFish;N/A;바로트라우마;N/A;05-06-2019;MonoGame;Linux, PC (Microsoft Windows), Mac
Keep Talking and Nobody Explodes;7,361;$14.99;0;Puzzle;Steel Crate Games;84.33333333333333;完全爆弾解除マニュアル: Keep Talking and Nobody Explodes;N/A;08-10-2015;N/A;Linux, PC (Microsoft Windows), Mac, Android, iOS, PlayStation 4, Xbox One, Nintendo Switch, Windows Mixed Reality, SteamVR, Daydream, PlayStation VR, Oculus Quest, Oculus Rift, Meta Quest 2, Gear VR
Hand of Fate;7,346;$19.99;0;Role-playing (RPG);Unbroken Studios;76.0909090909091;핸드 오브 페이트 2, Hand of Fate 2 (ハンドオブフェイト2), ハンドオブフェイト2;Hand of Fate;07-11-2017;N/A;Linux, PC (Microsoft Windows), Mac, PlayStation 4, Xbox One, Nintendo Switch
Crysis 2;7,291;$29.99;0;Shooter;Crytek Frankfurt;86.5;크라이시스 2, Crysis II;Crysis;22-03-2011;CryEngine;PC (Microsoft Windows), PlayStation 3, Xbox 360
Darksiders Warmastered Edition;7,281;$19.99;0;Fighting;Nordic Games Group;81.0;Darksiders Warmastered Edition（ダークサイダーズ ウォーマスターエディション）, ダークサイダーズ ウォーマスターエディション;Darksiders;22-11-2016;N/A;PC (Microsoft Windows), Wii U, PlayStation 4, Xbox One, Nintendo Switch
Secret Neighbor;7,280;$19.99;0;Adventure;DYNAMIC PIXELS;40.0;シークレットゥネイバー;Hello Neighbor;01-12-2020;N/A;PC (Microsoft Windows), iOS, PlayStation 4, Xbox One, Nintendo Switch, Google Stadia
Torchlight III;7,277;$39.99;0;Role-playing (RPG);Perfect World Entertainment;66.11111111111111;Torchlight MMO, Torchlight Frontiers;Torchlight;22-10-2020;Unreal Engine 4;PC (Microsoft Windows), PlayStation 4, Xbox One, Nintendo Switch
DYNASTY WARRIORS 8: Xtreme Legends Complete Edition;7,269;$49.99;0;Hack and slash/Beat 'em up;Koei Tecmo;70.25;真・三國無双7 with 猛将伝, Shin Sangoku Musou 7 with Moushouden;Dynasty Warriors;25-03-2014;N/A;PC (Microsoft Windows), PlayStation 3, PlayStation Vita, PlayStation 4
Warhammer 40,000: Dawn of War - Soulstorm;7,251;$12.99;0;Real Time Strategy (RTS);Relic Entertainment;80.0;DoW, DoW, 워해머 40,000: 다운 오브 워 - 소울스톰;Warhammer 40,000: Dawn of War;04-03-2008;N/A;PC (Microsoft Windows)
Momodora: Reverie Under the Moonlight;7,234;$9.99;0;Platform;Bombservice;82.83333333333333;Momodora IV, Momodora 4, Momodora: 月下のレクイエム;Momodora;16-03-2017;GameMaker: Studio;Linux, PC (Microsoft Windows), Mac, PlayStation 4, Xbox One, Nintendo Switch
Call of Duty: Modern Warfare 3;7,198;$39.99;0;Shooter;Treyarch;89.45454545454545;COD MW3, Call of Duty 8, CODMW3, COD8, MW3, Call of Duty: MW3, モダン・ウォーフェア３, モダン ウォーフェア３, 콜 오브 듀티: 모던 워페어 3;Call of Duty: Modern Warfare;08-11-2011;IW Engine;Wii, PC (Microsoft Windows), PlayStation 3, Xbox 360, Mac
Call of Duty: Modern Warfare 3;7,198;$39.99;0;Shooter;Treyarch;89.45454545454545;COD MW3, Call of Duty 8, CODMW3, COD8, MW3, Call of Duty: MW3, モダン・ウォーフェア３, モダン ウォーフェア３, 콜 오브 듀티: 모던 워페어 3;Call of Duty: Modern Warfare;08-11-2011;IW Engine;Wii, PC (Microsoft Windows), PlayStation 3, Xbox 360, Mac
DEEP SPACE WAIFU;7,173;$2.99;0;Shooter;Neko Climax Studios;N/A;DEEP SPACE WAIFU;DEEP SPACE WAIFU;31-05-2017;N/A;PC (Microsoft Windows)
Tropico 4;7,119;$14.99;0;Real Time Strategy (RTS);FX Interactive;74.25;Tropico IV, Tropico IV, トロピコ4;Tropico;26-08-2011;N/A;PC (Microsoft Windows), Xbox 360, Mac
Gorogoa;7,073;$14.99;0;Point-and-click;Annapurna Interactive;82.14285714285714;ゴロゴア, Горогоа;N/A;14-12-2017;Unity 2018;PC (Microsoft Windows), Mac, Android, iOS, PlayStation 4, Xbox One, Nintendo Switch
Hook;7,065;$0.99;0;Puzzle;Rainbow Train;N/A;HOOK;N/A;21-01-2015;N/A;Linux, PC (Microsoft Windows), Mac, Android, iOS, Windows Phone, Nintendo Switch
Grand Theft Auto III;7,063;$9.99;0;Shooter;DMA Design;95.0;GTA III, Grand Theft Auto 3, GTA3;Grand Theft Auto;22-10-2001;RenderWare;PC (Microsoft Windows), PlayStation 2, Xbox, Mac, Android, iOS, PlayStation 4
Darksiders III;7,013;$59.99;0;Role-playing (RPG);THQ Nordic;64.9375;Darksiders 3, 다크사이더스 III, 다크사이더스 3, Darksiders III（ダークサイダーズ３）, ダークサイダーズ3;Darksiders;27-11-2018;Unreal Engine 4;PC (Microsoft Windows), PlayStation 4, Xbox One, Nintendo Switch, Google Stadia
Stronghold Crusader 2;6,972;$39.99;0;Real Time Strategy (RTS);Firefly Studios;64.0;Stronghold Crusader 2;Stronghold: Crusader;22-09-2014;Vision;PC (Microsoft Windows)
Fallout;6,922;$9.99;0;Role-playing (RPG);Micro Forté;N/A;Fallout Tactics, Fallout Tactics: A Post Nuclear Tactical Combat Game, Fallout Tactics: BoS, FOBOS, Fallout: PoS, Fallout Tactics Classic, Fallout Tactics: BoS, FOBOS, Fallout: PoS, Fallout: BoS;Fallout;15-03-2001;N/A;PC (Microsoft Windows), Mac
Monster Prom;6,866;$11.99;0;Role-playing (RPG);Those Awesome Guys;66.0;Monster Prom XXL;Monster Prom;21-05-2020;N/A;PlayStation 4, Xbox One, Nintendo Switch
Five Nights at Freddy's 4;6,830;$7.99;0;Strategy;Scottgames;N/A;Five Nights at Freddy's 4 Mobile, FNAF 4 Mobile;Five Nights at Freddy's;26-07-2015;Clickteam Fusion;Android, iOS
Serious Sam 2;6,818;$9.99;0;Shooter;2K Games;78.33333333333333;Serious Sam 2, Serious Sam 2;Serious Sam;11-10-2005;Serious Engine;Linux, PC (Microsoft Windows), Xbox
RUINER;6,799;$19.99;0;Shooter;Devolver Digital;76.16666666666667;루이너, RUINER;N/A;26-09-2017;Unreal Engine;Linux, PC (Microsoft Windows), Mac, PlayStation 4, Xbox One, Nintendo Switch
Octodad: Dadliest Catch;6,797;$14.99;0;Platform;Young Horses;73.63636363636364;Octodad 2, Octodad 2, オクトダッド: タコと呼ばないで;Octodad;30-01-2014;N/A;Linux, PC (Microsoft Windows), Mac, Android, iOS, Wii U, PlayStation Vita, PlayStation 4, Xbox One, Nintendo Switch
SpongeBob SquarePants: Battle for Bikini Bottom - Rehydrated;6,781;$19.79;-34%;Platform;HandyGames;67.5;네모바지 스폰지밥: 비키니 시티의 전쟁 리하이드레이티드, スポンジ・ボブ：Battle for Bikini Bottom - Rehydrated;SpongeBob SquarePants;08-12-2020;Unreal Engine;PC (Microsoft Windows), Xbox 360, Android, iOS, PlayStation 4, Xbox One, Nintendo Switch, PlayStation 5, Xbox Series X|S, Google Stadia
Xuan-Yuan Sword VII;6,753;$34.99;0;Role-playing (RPG);DOMO Studio;65.0;轩辕剑柒, 軒轅劍柒, 軒轅剣 閻黒の業火, Kenenken: Enkoku no Gyouka, Xuan Yuan Sword 7, Xuan-Yuan Sword 7, SWD7, Xuanyuan Jianqi, XuanYuan 7, 헌원검 염묵의 업화;Xuan-Yuan Sword;28-10-2020;Unreal Engine 4;PC (Microsoft Windows), PlayStation 4, Xbox One
Bad Rats;6,751;$0.99;0;Platform;Invent4 Entertainment;N/A;Крысиная месть , Bad Rats: the Rats' Revenge;N/A;20-07-2009;N/A;PC (Microsoft Windows)
Children of Morta;6,745;$21.99;0;Role-playing (RPG);Dead Mage;83.0;チルドレン オブ モルタ 家族の絆の物語;N/A;03-09-2019;Unity;Linux, PC (Microsoft Windows), Mac, PlayStation 4, Xbox One, Nintendo Switch
The Witcher 3: Wild Hunt - Blood and Wine;6,736;$19.99;0;Role-playing (RPG);CD Projekt RED;92.0;Wiedźmin 3: Dziki Gon - Krew i wino, Ведьмак 3: Дикая Охота - Кровь и Вино;The Witcher;31-05-2016;REDengine;PC (Microsoft Windows), PlayStation 4, Xbox One, Nintendo Switch, PlayStation 5, Xbox Series X|S
Door Kickers;6,707;$19.99;0;Simulator;KillHouse Games;N/A;Door Kickers 2: Task Force North;N/A;03-11-2020;N/A;PC (Microsoft Windows)
Fallout 2;6,686;$9.99;0;Shooter;ConstructVOD;N/A;Fallout 2 3D, Fallout 2 First Person Remake, Fallout 2 Remake RPG 3D;Fallout;31-12-2022;N/A;PC (Microsoft Windows)
Football Manager 2021;6,657;$49.99;0;Simulator;Sports Interactive;88.33333333333333;풋볼 매니저 2021;Football Manager;24-11-2020;N/A;PC (Microsoft Windows), Mac
State of Decay: Year-One;6,611;$19.99;0;Shooter;Undead Labs;65.83333333333333;State of Decay: Year-One;State of Decay;28-04-2015;CryEngine;PC (Microsoft Windows), Xbox One
Devil May Cry 4 Special Edition;6,610;$24.99;0;Hack and slash/Beat 'em up;Capcom Production Studio 1;80.33333333333333;Devil May Cry 4 Special Edition, デビル メイ クライ4 スペシャルエディション;Devil May Cry;23-06-2015;MT Framework;PC (Microsoft Windows), PlayStation 4, Xbox One
Clustertruck;6,601;$14.99;0;Platform;Landfall Games;74.1;Highway Fight Squad;N/A;12-10-2016;Unity;Linux, PC (Microsoft Windows), Mac, PlayStation 4, Xbox One, Nintendo Switch
EVE Online;6,594;$0.00;0;Role-playing (RPG);CCP Games;78.75;EVE Online: Special Edition, EVE Online: Retribution, EVE Online: Inferno, EVE Online: Crucible, EVE Online: Incarna, EVE Online: Incursion, EVE Online: Tyrannis, EVE Online: Dominion, EVE Online: Apocrypha, EVE Online: Quantum Rise, EVE Online: Trinity, EVE Online: Quantum Rise, EVE Online: Inferno, EVE Online: Trinity, EVE Online: Crucible, EVE Online: Tyrannis, EVE Online: Incarna, EVE Online: Retribution, EVE Online: Incursion, EVE Online: Apocrypha, EVE Online: Special Edition, EVE Online: Dominion, 이브 온라인, EVE Online;EVE;06-05-2003;N/A;Linux, PC (Microsoft Windows), Mac
Orwell;6,585;$9.99;0;Simulator;Osmotic Studios;85.83333333333333;Orwell: Keeping an Eye on You;Orwell;27-10-2016;Unity;Linux, PC (Microsoft Windows), Mac, Android, iOS
Injustice™ 2;6,579;$49.99;0;Fighting;NetherRealm Studios;86.38888888888889;IJ2, I2, 다크세이드;Injustice;16-05-2017;N/A;PC (Microsoft Windows), PlayStation 4, Xbox One
Crash Bandicoot™ N. Sane Trilogy;6,515;$39.99;0;Platform;Activision;78.0;Crash Bandicoot: N. Sane Trilogy, クラッシュ・バンディクー ブッとび３段もり！, クラッシュ バンディクー ブッとび３段もり！;Crash Bandicoot;30-06-2017;Vicarious Visions Alchemy;PC (Microsoft Windows), PlayStation 4, Xbox One, Nintendo Switch
Cossacks 3;6,514;$19.99;0;Real Time Strategy (RTS);GSC Game World;80.0;Казаки 3;Cossacks;20-09-2016;N/A;Linux, PC (Microsoft Windows), Mac
Wasteland 3;6,508;$59.99;0;Role-playing (RPG);inXile Entertainment;87.11111111111111;웨이스트랜드 3;Wasteland;28-08-2020;Unity;Linux, PC (Microsoft Windows), Mac, PlayStation 4, Xbox One
Ultra Street Fighter IV;6,505;$29.99;0;Fighting;QLOC;79.42857142857143;USFIV, USF4, Ultra Street Fighter 4, ウルトラストリートファイターIV, Urutora Sutoriito Faitaa Fou, USF4, USFIV;Street Fighter IV;03-06-2014;Taito Type X;PC (Microsoft Windows), PlayStation 3, Xbox 360, PlayStation 4, Arcade
Griftlands;6,504;$15.99;-20%;Role-playing (RPG);Skymap Games;83.5;Griftlands（グリフトランド）, Grift Lands, グリフトランド;N/A;04-06-2021;N/A;Linux, PC (Microsoft Windows), Mac, PlayStation 4, Xbox One, Nintendo Switch
ATOM RPG;6,502;$14.99;0;Role-playing (RPG);AtomTeam;N/A;ATOM RPG: Post-apocalyptic indie game, ATOM RPG;N/A;19-12-2018;N/A;Linux, PC (Microsoft Windows), Mac, Android, iOS, PlayStation 4, Xbox One, Nintendo Switch
Forts;6,484;$14.99;0;Puzzle;André Birnfeld;N/A;Genius Quiz Fort, Genius Quiz Fortnite, Genius Quiz Fortnite Battle Royale, Gênio Quiz Fortnite, Gênio Quiz Fort, Gênio Quiz Fort. Battle Royale, Gênio Quiz Fortnite Battle Royale;Genius Quiz;04-07-2018;N/A;Android
Bloons TD5;6,470;$9.99;0;Simulator;Ninja Kiwi;N/A;Bloons TD5;Bloons TD;14-12-2011;N/A;PC (Microsoft Windows), Mac, Android, iOS, PlayStation 4, Xbox One, Web browser, Nintendo Switch
Half-Life: Blue Shift;6,451;$4.99;0;Shooter;Sierra Studios;60.0;HL: Blue Shift, HL: BS, HL: BS, HL: Blue Shift;Half-Life;31-07-2013;GoldSrc;Linux, PC (Microsoft Windows), Mac
Might & Magic: Heroes VI;6,413;$19.99;0;Role-playing (RPG);Black Hole Entertainment;77.66666666666667;MMH6, Меч и Магия: Герои VI, Might & Magic: Heroes 6, Heroes of Might and Magic VIHeroes of Might and Magic 6HoMM VIHoMM 6, HoMM VI, Heroes of Might and Magic 6, Heroes of Might and Magic VI, HoMM 6;Heroes of Might and Magic;25-11-2011;N/A;PC (Microsoft Windows)
Wolfenstein: Youngblood;6,364;$29.99;0;Shooter;Arkane Studios;71.25;Wolfenstein Youngblood, Wolfenstein: Youngblood - International Version;Wolfenstein;26-07-2019;id Tech 6;PC (Microsoft Windows), PlayStation 4, Xbox One, Nintendo Switch, Google Stadia
Machinarium;6,319;$14.99;0;Point-and-click;Amanita Design;87.5;머시나리움, Machinarium（マシナリウム）, マシナリウム ;N/A;06-09-2012;Adobe Flash Player;Linux, PC (Microsoft Windows), PlayStation 3, Mac, Android, iOS, PlayStation Vita, PlayStation 4, Xbox One, Nintendo Switch
Superliminal;6,307;$19.99;0;Shooter;Pillow Castle Games;78.57142857142857;Museum of Simulation Technology, 슈퍼리미널, 수퍼리미널, 超閾限空間;N/A;07-07-2020;N/A;Linux, PC (Microsoft Windows), Mac, PlayStation 4, Xbox One, Nintendo Switch, PlayStation 5, Xbox Series X|S
F.E.A.R.: Perseus Mandate;6,304;$54.99;0;Shooter;TimeGate Studios;70.0;FEAR Perseus Mandate, F.E.A.R.: Mission Perseus, F.E.A.R.: Проект «Персей»;F.E.A.R.;06-11-2007;LithTech Jupiter EX;PC (Microsoft Windows)
F.E.A.R.: Extraction Point;6,304;$54.99;0;Shooter;TimeGate Studios;73.33333333333333;FEAR Extraction Point, F.E.A.R.: Эвакуация;F.E.A.R.;24-10-2006;LithTech Jupiter EX;PC (Microsoft Windows)
The Vanishing of Ethan Carter;6,295;$19.99;0;Puzzle;The Astronauts;82.375;The Vanishing of Ethan Carter: Oculus Edition;N/A;25-09-2014;Unreal Engine;PC (Microsoft Windows), PlayStation 4, Xbox One, Nintendo Switch
Pit People;6,262;$19.99;0;Role-playing (RPG);The Behemoth;76.83333333333333;Behemoth Game 4;N/A;02-03-2018;N/A;PC (Microsoft Windows), Xbox One
ENDLESS™ Space - Definitive Edition;6,185;$9.99;0;Strategy;Amplitude Studios;N/A;ENDLESS Space - Definitive Edition;N/A;04-07-2012;Unity;PC (Microsoft Windows), Mac
PixARK;6,180;$39.99;0;Shooter;Snail Games;70.0;ピックスアーク;Ark;31-05-2019;N/A;PC (Microsoft Windows), PlayStation 4, Xbox One, Nintendo Switch
Five Nights at Freddy's: Sister Location;6,157;$7.99;0;Strategy;Scottgames;N/A;Five Nights at Freddy's: Sister Location - Mobile;Five Nights at Freddy's;22-12-2016;Clickteam Fusion;Android, iOS
Sherlock Holmes: The Devil's Daughter;6,132;$19.99;0;Puzzle;Frogwares;67.375;셜록 홈즈: 악마의 딸, シャーロック・ホームズ 悪魔の娘;Adventures of Sherlock Holmes;10-06-2016;Unreal Engine;PC (Microsoft Windows), PlayStation 4, Xbox One, Nintendo Switch
FINAL FANTASY VIII;6,070;$11.99;0;Role-playing (RPG);Eidos Interactive;N/A;FINAL FANTASY VIII, ファイナルファンタジーVIII, 最终幻想8, FF8, FFVIII, Final Fantasy 8, Финальная Фантазия 8;Final Fantasy;31-12-1999;N/A;PC (Microsoft Windows)
The Incredible Adventures of Van Helsing;6,065;$14.99;0;Role-playing (RPG);NeoCore Games;64.0;The Incredible Adventures of Van Helsing: Deathtrap, World of Van Helsing: Deathtrap;The Incredible Adventures of Van Helsing;22-05-2013;N/A;PC (Microsoft Windows), Xbox 360, Mac, PlayStation 4, Xbox One
Cloudpunk;6,027;$19.99;0;Role-playing (RPG);ION LANDS;75.71428571428571;클라우드펑크;N/A;23-04-2020;Unity;PC (Microsoft Windows), PlayStation 4, Xbox One, Nintendo Switch, PlayStation 5
Bendy and the Ink Machine;5,985;$19.99;0;Puzzle;Rooster Teeth Games;86.5;BaTIM;N/A;27-04-2017;Unity;Linux, PC (Microsoft Windows), Mac, iOS, PlayStation 4, Xbox One, Nintendo Switch
Furi;5,970;$19.99;0;Strategy;Planning Office Wada;N/A;Yuujin no Furi Furi Girls, Yuujin no Furi-furi Girls;N/A;01-07-1994;N/A;Super Famicom
Quake Champions;5,968;$0.00;0;Shooter;id Software;N/A;QC;Quake;22-08-2017;Saber3D;PC (Microsoft Windows)
Mafia II: Definitive Edition;5,949;$14.99;-50%;Shooter;2K;61.0;マフィアII コンプリート エディション;Mafia;19-05-2020;The Illusion Engine;PC (Microsoft Windows), PlayStation 4, Xbox One, Google Stadia
PROTOTYPE 2;5,937;$39.99;0;Platform;Activision;77.1;[PROTOTYPE2], [PROTOTYPE 2], Prototype®2;Prototype;24-04-2012;Titanium;PC (Microsoft Windows), PlayStation 3, Xbox 360, PlayStation 4, Xbox One
Prototype;5,870;$19.99;0;Visual Novel;Nikita Kryukov;N/A;PROTOTYPE原型;N/A;04-02-2023;N/A;PC (Microsoft Windows)
Age of Empires: Definitive Edition;5,862;$19.99;0;Real Time Strategy (RTS);Forgotten Empires LLC;70.0;帝国时代决定版, Darwin, Age of Empires 1: Remastered, AoE1;Age of Empires;20-02-2018;Genie Engine;PC (Microsoft Windows)
Age of Wonders III;5,772;$29.99;0;Role-playing (RPG);Triumph Studios;79.6;Age of Wonders 3;Age of Wonders;31-03-2014;N/A;Linux, PC (Microsoft Windows), Mac
Turmoil;5,747;$9.99;0;Shooter;Sirius Software;N/A;Turmoil, Turmoill, Termoil, Termool, Space Grid, ターモイル;N/A;31-12-1982;N/A;Commodore C64/128/MAX, Atari 2600, Atari 8-bit, Commodore VIC-20
OMORI;5,715;$19.99;0;Role-playing (RPG);OMOCAT;82.5;오모리, OMORI, オーエムオリ;N/A;25-12-2020;RPG Maker MV;PC (Microsoft Windows), Mac, PlayStation 4, Xbox One, Nintendo Switch, Xbox Series X|S
FINAL FANTASY IX;5,695;$20.99;0;Role-playing (RPG);Square;N/A;FINAL FANTASY IX Digital Edition, FF9, FFIX, Final Fantasy 9;Final Fantasy;19-09-2017;N/A;PlayStation 4, Xbox One, Nintendo Switch
Tales of Zestiria;5,691;$49.99;0;Role-playing (RPG);QLOC;76.91666666666667;テイルズ オブ ゼスティリア;Tales;16-10-2015;N/A;PC (Microsoft Windows), PlayStation 3, PlayStation 4
Trine 4: The Nightmare Prince;5,686;$29.99;0;Platform;Frozenbyte;78.0;Trine 4, トライン 4: ザ ナイトメア プリンス, 트라인 4: 악몽의 왕자;Trine;08-10-2019;Unity;PC (Microsoft Windows), PlayStation 4, Xbox One, Nintendo Switch, Google Stadia
Darksiders Genesis;5,682;$29.99;0;Role-playing (RPG);THQ Nordic;74.63636363636364;다크사이더스 제네시스, Darksiders Genesis（ダークサイダーズ ジェネシス）, ダークサイダーズ ジェネシス ;Darksiders;05-12-2019;Unreal Engine 4;PC (Microsoft Windows), PlayStation 4, Xbox One, Nintendo Switch, Google Stadia
SYNTHETIK;5,645;$19.99;0;Shooter;Flow Fire Games;N/A;SYNTHETIK 2;N/A;11-11-2021;N/A;PC (Microsoft Windows)
Spyro™ Reignited Trilogy;5,641;$39.99;0;Platform;Toys for Bob;83.53846153846153;Spyro the Dragon Remake, Spyro the Dragon Trilogy Remastered;Spyro the Dragon;13-11-2018;Unreal Engine 4;PC (Microsoft Windows), PlayStation 4, Xbox One, Nintendo Switch
Kingdom Rush;5,569;$9.99;0;Real Time Strategy (RTS);Armor Games;75.0;王国保卫战, 皇家守卫军, Kingdom Rush - タワーディフェンス;Kingdom Rush;19-12-2011;N/A;Linux, PC (Microsoft Windows), Mac, Android, iOS, Xbox One, Nintendo Switch
Warhammer 40,000: Mechanicus;5,529;$29.99;0;Role-playing (RPG);Kasedo Games;76.5;Warhammer 40k: Mechanicus, Mechanicus, ウォーハンマー40,000:メカニカス;N/A;17-07-2020;N/A;Linux, PC (Microsoft Windows), Mac, iOS, PlayStation 4, Xbox One, Nintendo Switch
Aliens: Colonial Marines;5,472;$29.99;0;Shooter;Sega;45.0;Aliens;Alien;12-02-2013;Red Ring;PC (Microsoft Windows), PlayStation 3, Xbox 360
Company of Heroes;5,459;$19.99;0;Real Time Strategy (RTS);THQ;95.0;CoH, COHO;Company of Heroes;29-09-2006;Havok Physics;PC (Microsoft Windows), iOS
Ni no Kuni™ II: Revenant Kingdom;5,415;$59.99;0;Role-playing (RPG);Bandai Namco Entertainment;86.28571428571429;Ni No Kuni 2, 二ノ国II レヴァナントキングダム;Ni no Kuni;23-03-2018;N/A;PC (Microsoft Windows), PlayStation 4, Xbox One, Xbox Series X|S
Yakuza Kiwami;5,414;$19.99;0;Role-playing (RPG);Deep Silver;82.16666666666667;Ryuu ga Gotoku Kiwami, 용과 같이 극, 龍が如く 極;Yakuza;21-01-2016;N/A;PC (Microsoft Windows), PlayStation 3, PlayStation 4, Xbox One
Little Witch Nobeta;5,404;$9.99;0;Shooter;Pupuya Games;70.5;작은 마녀 노베타, リトルウィッチノベタ;N/A;24-06-2020;N/A;PC (Microsoft Windows), PlayStation 4, Nintendo Switch
ULTRAKILL;5,401;$19.99;0;Shooter;New Blood Interactive;N/A;ULTRAKILL;N/A;03-09-2020;Unity;PC (Microsoft Windows)
Kingdom: Classic;5,401;$0.00;0;Simulator;Raw Fury Games;70.0;Kingdom;Kingdom;21-10-2015;Unity;Linux, PC (Microsoft Windows), Mac
Late Shift;5,373;$12.99;0;Simulator;CtrlMovie;52.0;レイト・シフト;N/A;18-04-2017;N/A;PC (Microsoft Windows), Mac, PlayStation 4, Xbox One, Nintendo Switch, PlayStation 5
Arizona Sunshine;5,354;$39.99;0;Shooter;Vertigo Games;N/A;Arizona Sunshine 2;Arizona Sunshine;31-12-2023;N/A;SteamVR, Meta Quest 2, PlayStation VR2
DYNASTY WARRIORS 9;5,347;$44.99;0;Role-playing (RPG);Omega Force;65.125;Shin Sangoku Musou 8, 真・三國無双8, 진・삼국무쌍８, 진・삼국무쌍８ Empires;Dynasty Warriors;13-02-2018;N/A;PC (Microsoft Windows), PlayStation 4, Xbox One
Valley;5,335;$14.99;0;Adventure;Konami Computer Entertainment Tokyo;N/A;幻想水滸外伝Vol.2 クリスタルバレーの決闘, Genso Suikogaiden Vol. 2, Gensō Suikogaiden: Duel at Crystal Valley, 幻想水滸外伝: クリスタルバレーの決闘, Gensō Suikogaiden: Kurisutaru Bare no Kettou, Gensō Suiko Gaiden: Vol.2 - Crystal Valley no Kettō, 幻想水滸外伝　Vol. 2 クリスタルバリーの決闘, Suikogaiden II, Gensou Suiko Gaiden Vol. 2: Crystal Valley no Kettou;Suikoden;22-03-2001;N/A;PlayStation
Trailmakers;5,326;$24.99;0;Racing;Flashbulb Games;N/A;トレイルメーカーズ;N/A;18-09-2019;Unity;PC (Microsoft Windows), PlayStation 4, Xbox One, PlayStation 5
ONE PIECE PIRATE WARRIORS 3;5,312;$39.99;0;Hack and slash/Beat 'em up;Koei Tecmo Games;76.42857142857143;One Piece: Kaizoku Musou 3, ワンピース海賊無双 3;One Piece;26-03-2015;N/A;PC (Microsoft Windows), PlayStation 3, PlayStation Vita, PlayStation 4, Nintendo Switch
Warhammer 40,000: Dawn of War II - Retribution;5,277;$29.99;0;Real Time Strategy (RTS);Relic Entertainment;88.0;Warhammer 40,000: Dawn of War 2: Retribution, Dawn of War II - Retribution, Warhammer 40,000: Dawn of War 2: Retribution;Warhammer 40,000: Dawn of War;01-03-2011;Essence Engine;Linux, PC (Microsoft Windows), Mac
SOULCALIBUR VI;5,272;$59.99;0;Fighting;Project Soul;83.85714285714286;SoulCalibur 6, Soul Calibur VI, Soul Calibur 6, SOULCALIBUR Ⅵ 디지털 디럭스 에디션, 소울 칼리버 VI;SoulCalibur;19-10-2018;Unreal Engine 4;PC (Microsoft Windows), PlayStation 4, Xbox One
Master of Orion;5,234;$24.99;0;Strategy;NGD Studios;74.33333333333333;Master of Orion: Conquer the Stars;Master of Orion;25-08-2016;N/A;Linux, PC (Microsoft Windows), Mac
SimCity 4 Deluxe;5,209;$19.99;0;Simulator;Electronic Arts;N/A;SimCity 4 DX, SC4DX;SimCity;22-09-2003;N/A;PC (Microsoft Windows), Mac
Call of Cthulhu;5,195;$29.99;0;Role-playing (RPG);Cyanide Studio;64.75;CoC, Call of Cthulhu: The Official Video Game, コール・オブ・クトゥルフ;Call of Cthulhu;30-10-2018;Unreal Engine 4;PC (Microsoft Windows), PlayStation 4, Xbox One, Nintendo Switch
Braid;5,193;$14.99;0;Platform;Number None Inc.;86.66666666666667;Braid Alias, 브레이드;N/A;10-04-2009;N/A;Linux, PC (Microsoft Windows), PlayStation 3, Xbox 360, Mac
Yakuza: Like a Dragon;5,191;$59.99;0;Role-playing (RPG);Sega;86.0625;Yakuza 7, Ryuu ga Gotoku 7: Hikari to Yami no Yukue, 龍が如く７　光と闇の行方　インターナショナル, 龍が如く7 光と闇の行方 , 용과 같이7 빛과 어둠의 행방　International, 용과 같이7 빛과 어둠의 행방;Yakuza;02-03-2021;Dragon Engine;PC (Microsoft Windows), PlayStation 4, Xbox One, PlayStation 5, Xbox Series X|S
Need for Speed™;5,188;$29.99;0;Racing;Electronic Arts;84.73684210526316;Need for Speed: Most Wanted - A Criterion Game, NFSMW, NFSMW2, Need For Speed Most Wanted 2, Need For Speed 2012, Need For Speed Most Wanted U, Need For Speed Most Wanted 2, NFS: Most Wanted;Need for Speed;30-10-2012;Chameleon;PC (Microsoft Windows), PlayStation 3, Xbox 360
The Darkness II;5,163;$5.99;-80%;Shooter;Retro Studios;N/A;Wiiであそぶ メトロイドプライム2 ダークエコーズ, New Play Control! Metroid Prime 2: Dark Echoes, Metroid Prime 2: Dark Echoes - Wii de Asobu, New Play Control! Metroid Prime 2: Echoes, Wii de Asobu: Metroid Prime 2;Metroid Prime;11-06-2009;N/A;Wii
Dungreed;5,160;$9.99;0;Platform;Nicalis, Inc.;N/A;던그리드, ダングリード;N/A;27-10-2020;N/A;Linux, PC (Microsoft Windows), Mac, PlayStation 4, Nintendo Switch
Long Live The Queen;5,159;$9.99;0;Role-playing (RPG);Hanako Games;70.0;ロング リブ ザ クイーン 女王への道しるべ;N/A;02-06-2012;N/A;Linux, PC (Microsoft Windows), Mac, PlayStation 4, Xbox One, Nintendo Switch, PlayStation 5, Xbox Series X|S
