Game title;Amount of recommendations;Current price;Current discount;Genre;Publisher;Rating;Names;Collection;Release;engine;Platforms
Counter-Strike: Global Offensive;2,999,135;$0.00;0;Shooter;Hidden Path Entertainment;81.0;Counter-Strike: Ofensiva Global, Counterstrike: Global Offensive, CSGO, CS:GO, CS: Global Offensive, 反恐精英：全球攻势, 글옵, 카운터 스트라이크: 글로벌 오펜시브, カウンターストライク グローバルオフェンシブ;Counter-Strike;21-08-2012;Source;Linux, PC (Microsoft Windows), PlayStation 3, Xbox 360, Mac
PUBG: BATTLEGROUNDS;1,382,744;$29.99;0;Shooter;Bluehole Studio;75.0625;Battlegrounds, Player Unknown, PUBG, PLAYERUNKNOWN'S BATTLEGROUNDS, 펍지, 배그, 배틀그라운드, 绝地求生, 絕地求生, PUBG: BATTLEGROUNDS;N/A;20-12-2017;Unreal Engine 4;PC (Microsoft Windows), PlayStation 4, Xbox One, Google Stadia
Tom Clancy's Rainbow Six Siege;710,454;$19.99;0;Shooter;Ubisoft Montreal;74.16666666666667;R6:S, R6S, R6: Siege, 彩虹六号：围攻, Regenbogen 6 Belagerung, 레식, Rainbow Six Siege, Tom Clancy's Rainbow Six: Siege, レインボーシックス シージ, 레인보우 식스 시즈;Rainbow Six;01-12-2020;AnvilNext;PC (Microsoft Windows), PlayStation 4, Xbox One, PlayStation 5, Xbox Series X|S, Google Stadia
Garry's Mod;557,779;$9.99;0;Simulator;Facepunch Studios;N/A;GMod, 게리 모드, gmod 9, gmod;N/A;24-12-2004;Source;Linux, PC (Microsoft Windows), Mac
Terraria;536,708;$9.99;0;Platform;Headup Games;81.0;Terraria: Journey's End, テラリア, 테라리아 (Terraria), 테라리아;Terraria;16-05-2011;N/A;Linux, PC (Microsoft Windows), PlayStation 3, Xbox 360, Mac, Android, Nintendo 3DS, iOS, Wii U, PlayStation Vita, PlayStation 4, Xbox One, Windows Phone, Nintendo Switch, Google Stadia
Rust;441,040;$39.99;0;Shooter;Facepunch Studios;77.5;러스트;N/A;21-05-2021;Unity;Linux, PC (Microsoft Windows), Mac, PlayStation 4, Xbox One
Among Us;437,476;$3.99;-20%;Point-and-click;Telltale Games;83.6;The Wolf Among Us Episode 5, The Wolf Among Us: Cry Wolf;The Wolf Among Us;08-07-2014;Telltale Tool;PC (Microsoft Windows), PlayStation 3, Xbox 360, Mac
The Witcher 3: Wild Hunt;433,689;$39.99;0;Role-playing (RPG);Bandai Namco Games;N/A;The Witcher III Wild Hunt + Dark Souls III Compilation, The Witcher 3: Wild Hunt / Dark Souls III;N/A;26-10-2018;N/A;PlayStation 4, Xbox One
ARK: Survival Evolved;319,463;$10.00;-80%;Shooter;Studio Wildcard;68.875;Arche: Überleben Entwickelt, 아크 서바이벌 이볼브드, 方舟：生存进化, ARK: Survival Evolved, ARK: Survival of the Fittest, 方舟：生存進化;Ark;29-08-2017;Unreal Engine;Linux, PC (Microsoft Windows), Mac, Android, iOS, PlayStation 4, Xbox One, Nintendo Switch, Google Stadia
Left 4 Dead 2;313,562;$9.99;0;Shooter;Valve;88.6;L4D2, L4D2;Left 4 Dead;17-11-2009;Source;Linux, PC (Microsoft Windows), Xbox 360, Mac
Dead by Daylight;309,366;$19.99;0;Strategy;Behaviour Interactive;N/A;Dead by Daylight - Headcase, Dead by Daylight: Head Case;N/A;08-06-2017;N/A;PC (Microsoft Windows), PlayStation 4, Xbox One, PlayStation 5, Xbox Series X|S, Google Stadia
PAYDAY 2;304,867;$9.99;0;Shooter;Overkill Software;74.76470588235294;Payday: The Heist 2, PAYDAY 2, PAYDAY: The Heist 2;Payday;13-08-2013;Diesel;Linux, PC (Microsoft Windows), PlayStation 3, Xbox 360, PlayStation 4, Xbox One, Nintendo Switch
Euro Truck Simulator 2;294,564;$19.99;0;Simulator;SCS Software;N/A;Euro Truck Simulator 2 - Edition Limitée;N/A;31-12-2013;N/A;PC (Microsoft Windows)
Stardew Valley;270,751;$14.99;0;Role-playing (RPG);Sickhead Games;90.53846153846153;スターデューバレー, 星露谷物语, 스타듀 밸리;N/A;26-02-2016;Microsoft XNA;Linux, PC (Microsoft Windows), Mac, Android, iOS, PlayStation Vita, PlayStation 4, Xbox One, Nintendo Switch
DayZ;214,152;$44.99;0;Shooter;Bohemia Interactive Studio;69.0;DayZ Standalone;N/A;27-03-2019;Enfusion;PC (Microsoft Windows), PlayStation 4, Xbox One
The Forest;205,935;$19.99;0;Role-playing (RPG);Primary Orbit;60.0;メルヘンフォーレスト～メルンちゃんと森の贈り物～, Marchen Forest: Mylne and the Forest Gift;N/A;28-01-2021;N/A;PC (Microsoft Windows), PlayStation 4, Nintendo Switch
Phasmophobia;187,721;$13.99;0;Puzzle;Kinetic Games;N/A;파스모포비아, 恐鬼症;N/A;18-09-2020;Unity 2019;PC (Microsoft Windows), Windows Mixed Reality, SteamVR, PlayStation 5, Xbox Series X|S, Oculus Rift, PlayStation VR2
Monster Hunter: World;183,844;$29.99;0;Role-playing (RPG);Capcom;93.25;MHW, 몬스터 헌터: 월드, 몬헌월드, モンスターハンター：ワールド, 魔物獵人：世界;Monster Hunter;26-01-2018;MT Framework;PC (Microsoft Windows), PlayStation 4, Xbox One
The Elder Scrolls V: Skyrim;174,055;$19.99;0;Role-playing (RPG);Bethesda Game Studios;96.11111111111111;TES5, The Elder Scrolls 5: Skyrim, Skyrim, TESV: Skyrim, TES Skyrim;The Elder Scrolls;11-11-2011;Creation Engine;PC (Microsoft Windows), PlayStation 3, Xbox 360
Borderlands 2;163,139;$4.99;-75%;Shooter;Gearbox Software;80.70588235294117;BL2, 보더랜드 2;Borderlands;18-09-2012;Unreal Engine;Linux, PC (Microsoft Windows), PlayStation 3, Xbox 360, Mac, Android, PlayStation Vita, PlayStation 4, Xbox One, Nintendo Switch
DARK SOULS™ III;156,644;$59.99;0;Role-playing (RPG);Bandai Namco Entertainment;86.07692307692308;Dunkle Seelen III, Dark Souls 3, ダークソウルズIII, 黑暗之魂III, 다크 소울 3, DS3, DARK SOULS III;Dark Souls;12-04-2016;N/A;PC (Microsoft Windows), PlayStation 4, Xbox One
Z1 Battle Royale;148,039;$0.00;0;Shooter;Daybreak Game Company;66.25;H1Z1: King of the Kill, h1z1kotk, H1Z1, H1Z1: Battle Royale;H1Z1;28-02-2018;N/A;PC (Microsoft Windows), PlayStation 4
No Man's Sky;147,634;$59.99;0;Role-playing (RPG);505 Games;73.84210526315789;No Man's Sky Atlas Rises, No Man's Sky Foundation, No Man's Sky Pathfinder, No Man's Sky NEXT, No Man's Sky Abyss, No Man's Sky Visions, No Man's Sky Beyond, No Man's Sky Synthesis, No Man's Sky Living Ship, No Man's Sky Exo Mech, No Man's Sky Crossplay, No Man's Sky Desolation, No Man's Sky Origins, No Man's Sky Next Generation, No Man's Sky Companions, No Man's Sky Expeditions, No Man's Sky Prisms, 노 맨즈 스카이, No Man's Sky Frontiers, ノーマンズスカイ;N/A;12-08-2016;Custom built engine;PC (Microsoft Windows), Mac, PlayStation 4, Xbox One, SteamVR, PlayStation VR, PlayStation 5, Xbox Series X|S, Oculus Rift, PlayStation VR2
Red Dead Redemption 2;142,719;$59.99;0;Shooter;Take-Two Interactive;94.05882352941177;RDR2, 레드 데드 리뎀션 2, RDR 2, 레데리2, ريد ديد ريدمبشن 2, 荒野大镖客2, Red Dead Redemption II, レッドデッドリデンプション2;Red Dead Redemption;26-10-2018;RAGE;PC (Microsoft Windows), PlayStation 4, Xbox One, Google Stadia
Subnautica;141,447;$29.99;0;Adventure;Bandai Namco Entertainment America;N/A;Subnautica + Subnautica: Below Zero, Subnautica and Subnautica: Below Zero, Subnautica + Subnautica: Below Zeroサブノーティカ + サブノーティカ：ビロウゼロ, サブノーティカ + サブノーティカ：ビロウゼロ;N/A;14-05-2021;N/A;PlayStation 4, Xbox One, Nintendo Switch, PlayStation 5
Fallout 4;140,761;$29.99;0;Shooter;Bethesda Game Studios;84.66666666666667;FO4, 폴아웃 4;Fallout;10-11-2015;Creation Engine;PC (Microsoft Windows), PlayStation 4, Xbox One, PlayStation 5, Xbox Series X|S
Arma 3;134,000;$29.99;0;Shooter;Bohemia Interactive Studio;72.8;아르마 3, アルマ 3, ArmA III, Arma 3, ArmA: Armed Assault ;ArmA;12-09-2013;Real Virtuality 4;Linux, PC (Microsoft Windows), Mac
Halo: The Master Chief Collection;128,993;$39.99;0;Shooter;343 Industries;86.0;Halo: MCC, Halo MCC, 光晕大师酋长合集, Halo：マスターチーフコレクション, Halo: Die Master Chief Collection, 헤일로: 마스터 치프 컬렉션;Halo;11-11-2014;Halo Reach;PC (Microsoft Windows), Xbox One, Xbox Series X|S
Undertale;127,319;$9.99;0;Role-playing (RPG);8-4;96.38461538461539;アンダーテール, UT, 언더테일, UNDERTALE;Undertale;15-09-2015;GameMaker: Studio;Linux, PC (Microsoft Windows), Mac, PlayStation Vita, PlayStation 4, Xbox One, Nintendo Switch
Hollow Knight;120,877;$14.99;0;Platform;Team Cherry;91.25;Hollow Knight (ホロウナイト）, ホロウナイト ;Hollow Knight;24-02-2017;Unity;Linux, PC (Microsoft Windows), Mac, Nintendo Switch
Mount & Blade II: Bannerlord;119,795;$49.99;0;Role-playing (RPG);Taleworlds;80.0;Mount and Blade 2: Bannerlord, Mount & Blade 2: Bannerlord, Mount and Blade 2, 마운트 앤 블레이드 2: 배너로드;Mount & Blade;30-03-2020;In-house engine;PC (Microsoft Windows), PlayStation 4, Xbox One, PlayStation 5, Xbox Series X|S
Hades;113,048;$24.99;0;Role-playing (RPG);Supergiant Games;94.0625;하데스, ハデス;N/A;17-09-2020;Proprietary Engine;PC (Microsoft Windows), Mac, PlayStation 4, Xbox One, Nintendo Switch, PlayStation 5, Xbox Series X|S
The Binding of Isaac: Rebirth;109,982;$14.99;0;Shooter;Nicalis, Inc.;95.0;アイザックの伝説：リバース;The Binding of Isaac;04-11-2014;Custom built engine;Linux, PC (Microsoft Windows), Mac, Nintendo 3DS, iOS, Wii U, PlayStation Vita, PlayStation 4, Xbox One, New Nintendo 3DS
7 Days to Die;109,287;$24.99;0;Shooter;The Fun Pimps Entertainment LLC;36.125;7 Jours Pour Mourir, 7 Tage Zu Sterben, 7 Dias Para Morrer, 7d2d, 세븐 데이즈 투 다이;N/A;28-06-2016;Unity;Linux, PC (Microsoft Windows), Mac, PlayStation 4, Xbox One
Tomb Raider;108,437;$14.99;0;Shooter;Core Design;61.5;Tomb Raider VI: The Angel of Darkness, Tomb Raider 6, Tomb Raider AoD, Tomb Raider : L'Ange des Ténèbres, Tomb Raider: El Ángel de la Oscuridad, Tomb Raider: Ангел Тьмы, 古墓奇兵：暗黑天使, 古墓丽影：黑暗天使, TR6, TRVI, トゥームレイダー美しき逃亡者, Tomb Raider: The Pretty Fugitive, Lara Croft: Tomb Raider - The Angel of Darkness;Tomb Raider;18-12-2003;N/A;PC (Microsoft Windows), PlayStation 2, Mac
Sid Meier's Civilization V;105,887;$29.99;0;Simulator;2K Games;86.6;Civilization 5, Civ V, Civ 5, Civilization V, Civilization 5Civ 5Civ VCivilisation 5Civilisation V, Civ V, Civilisation V, Civilization 5, Civ 5, Civilisation 5, 시드 마이어의 문명 V, 시드 마이어의 문명 5;Civilization;23-11-2010;Firaxis LORE;Linux, PC (Microsoft Windows), Mac
Sid Meier's Civilization V;105,885;$29.99;0;Simulator;2K Games;86.6;Civilization 5, Civ V, Civ 5, Civilization V, Civilization 5Civ 5Civ VCivilisation 5Civilisation V, Civ V, Civilisation V, Civilization 5, Civ 5, Civilisation 5, 시드 마이어의 문명 V, 시드 마이어의 문명 5;Civilization;23-11-2010;Firaxis LORE;Linux, PC (Microsoft Windows), Mac
Life is Strange™;104,492;$0.00;0;Adventure;Square Enix;81.75;Life is Strange 2 - 전체 시즌, 라이프 이즈 스트레인지 2;Life is Strange;27-09-2018;Unreal Engine;Linux, PC (Microsoft Windows), Mac, PlayStation 4, Xbox One, Nintendo Switch
Counter-Strike;101,721;$9.99;0;Shooter;Vivendi Universal;70.0;CS, Half-Life: Counter-Strike, Counter-Strike 1.6, CS1.6;Counter-Strike;14-02-2013;GoldSrc;Linux, PC (Microsoft Windows), Xbox, Mac
Sid Meier's Civilization VI;101,137;$14.99;-75%;Simulator;Firaxis Games;87.4;Civ6, Civilization 6, Civ 6, Civilisation VI, Civ VI, Civilisation 6, Civilization VI, 시드 마이어의 문명 6, 시드 마이어의 문명 VI, 문명 VI, シドマイヤーズ シヴィライゼーション VI;Civilization;21-10-2016;N/A;Linux, PC (Microsoft Windows), Mac, iOS, PlayStation 4, Xbox One, Nintendo Switch
DOOM Eternal;97,066;$59.99;0;Shooter;Panic Button Games;86.07142857142857;둠 이터널, DOOM Eternal;Doom;08-12-2020;id Tech 7;PC (Microsoft Windows), PlayStation 4, Xbox One, Nintendo Switch, PlayStation 5, Xbox Series X|S, Google Stadia
Mount & Blade: Warband;96,519;$19.99;0;Shooter;Paradox Interactive;68.6;M&B Warband, Mount and Blade: Warband;Mount & Blade;16-09-2016;N/A;Linux, PC (Microsoft Windows), Mac, PlayStation 4, Xbox One
Human: Fall Flat;95,511;$5.99;-60%;Platform;Curve Digital;72.76923076923077;휴먼: 폴 플랫, ヒューマン フォール フラット;Human Fall Flat;22-07-2016;Unity;Linux, PC (Microsoft Windows), Mac, Android, iOS, PlayStation 4, Xbox One, Nintendo Switch, PlayStation 5, Xbox Series X|S, Google Stadia
Destiny 2;94,995;$0.00;0;Shooter;Activision;82.44;D2, 命运2, 데스티니 가디언즈, Destiny Guardians, Destiny: Guardians, デスティニー 2, 天命2;Destiny;06-09-2017;Tiger;PC (Microsoft Windows), PlayStation 4, Xbox One, PlayStation 5, Xbox Series X|S, Google Stadia
Risk of Rain 2;94,324;$24.99;0;Shooter;Gearbox Publishing;87.33333333333333;RoR 2, Risk of Rain II, 리스크 오브 레인 2, Risk of Rain 2：リスク・オブ・レイン ２, リスク オブ レイン 2;Risk of Rain;29-09-2020;Unity;PC (Microsoft Windows), PlayStation 4, Xbox One, Nintendo Switch, Google Stadia
Fallout: New Vegas;92,010;$9.99;0;Shooter;Obsidian Entertainment;81.9;FNV, New Vegas, NV, 폴아웃: 뉴 베가스;Fallout;19-10-2010;Gamebryo;PC (Microsoft Windows), PlayStation 3, Xbox 360
DOOM;90,348;$19.99;0;Shooter;Nerve Software, LLC;N/A;DOOM II Classic, Doom II: Unity Edition, DOOM II (Clásico), DOOM II (Classico), DOOM II (Classic), Doom II Unity Edition, DOOM II;N/A;26-07-2019;N/A;PC (Microsoft Windows), iOS, PlayStation 4, Xbox One, Nintendo Switch
Factorio;87,988;$30.00;0;Simulator;Wube Software;85.5;팩토리오;N/A;14-08-2020;N/A;Linux, PC (Microsoft Windows), Mac, Nintendo Switch
Hearts of Iron IV;87,268;$39.99;0;Real Time Strategy (RTS);Paradox Development Studio;83.83333333333333;Hearts of Iron 4, HOI 4;Hearts of Iron;06-06-2016;Clausewitz Engine;Linux, PC (Microsoft Windows), Mac
Half-Life 2;86,260;$9.99;0;Shooter;Sierra Entertainment;91.0;HL2, Half Life 2, HL 2, HL2;Half-Life;16-11-2004;Source;Linux, PC (Microsoft Windows), PlayStation 3, Xbox, Xbox 360, Mac, Android
Sekiro™: Shadows Die Twice;84,192;$38.99;-35%;Hack and slash/Beat 'em up;FromSoftware;90.0909090909091;Sekiro: Schatten Sterben Zweimal, 세키로: 섀도우 다이 트와이스, Shadows Die Twice,  SEKIRO: SHADOWS DIE TWICE, 隻狼, SEKIRO, 세키로: 그림자는 두 번 죽는다, 只狼：影逝二度, 隻狼：暗影雙死;N/A;22-03-2019;N/A;PC (Microsoft Windows), PlayStation 4, Xbox One, Google Stadia
Insurgency;83,615;$14.99;0;Shooter;New World Interactive;70.0;Insurgency 2;Insurgency;22-01-2014;Source;Linux, PC (Microsoft Windows), Mac
Assassin's Creed Odyssey;82,411;$59.99;0;Role-playing (RPG);Ubisoft Entertainment;N/A;アサシン クリード ミソロジーパック, Assassin's Creed 신화 팩, 어쌔신 크리드 신화 팩;Assassin's Creed;12-11-2020;N/A;Xbox One, Xbox Series X|S
Sea of Thieves;79,606;$39.99;0;Simulator;Purple Lamp Studios;66.41666666666667;도둑의 바다, 盗贼之海, Mar dos Ladrões, Meer der Diebe;N/A;20-03-2018;Unreal Engine 4;PC (Microsoft Windows), Xbox One, Xbox Series X|S
RimWorld;78,736;$34.99;0;Real Time Strategy (RTS);Ludeon Studios;74.5;リムワールド, 림월드;N/A;17-10-2018;Unity;Linux, PC (Microsoft Windows), Mac
BioShock Infinite;78,369;$7.49;-75%;Shooter;Irrational Games;93.21428571428571;Project Icarus, 바이오쇼크 인피니트, BioShock: Infinity, BioShock 3;Bioshock;25-03-2013;Unreal Engine;Linux, PC (Microsoft Windows), PlayStation 3, Xbox 360, Mac, PlayStation 4, Xbox One, Nintendo Switch
The Elder Scrolls Online;76,027;$19.99;0;Role-playing (RPG);ZeniMax Online Studios;70.4375;ESO, Elder Scrolls: Online, Elder Scrolls MMO, Der Ältere Scrollt Online, TESO, The Elder Scrolls Online: Tamriel Unlimited, 上古卷轴在线, TES Online, ESO, Elder Scrolls: Online, TESO, Elder Scrolls MMO, The Elder Scrolls Online: Tamriel Unlimited Beta, The Elder Scrolls Online: Tamriel Unlimited, The Elder Scrolls® Online;The Elder Scrolls;09-06-2015;HeroEngine;PC (Microsoft Windows), Mac, PlayStation 4, Xbox One, PlayStation 5, Xbox Series X|S, Google Stadia
Counter-Strike: Source;75,369;$9.99;0;Shooter;Valve;90.0;CS:S, Counterstrike: Source, CS, CSS;Counter-Strike;01-11-2004;Source;Linux, PC (Microsoft Windows), Mac
Slay the Spire;73,893;$24.99;0;Role-playing (RPG);Humble Games;92.66666666666667;슬레이 더 스파이어;N/A;23-01-2019;N/A;Linux, PC (Microsoft Windows), Mac, Android, iOS, PlayStation 4, Xbox One, Nintendo Switch
Rise of the Tomb Raider;71,772;$29.99;0;Shooter;Microsoft Studios;87.04;Rise of the Tomb Raider: 20 Year Celebration;Tomb Raider;10-11-2015;Foundation Engine;Linux, PC (Microsoft Windows), Xbox 360, Mac, PlayStation 4, Xbox One, Google Stadia
Age of Empires II (2013);70,910;$19.99;0;Real Time Strategy (RTS);Hidden Path Entertainment;50.0;AoE 2: HD, Age of Empires II Remastered, Age of Empires 2 Update, Age of Empires (2013);Age of Empires;09-04-2013;Genie Engine;PC (Microsoft Windows)
Kerbal Space Program;70,068;$39.99;0;Simulator;Squad;86.57142857142857;KSP;N/A;27-04-2015;Unity;Linux, PC (Microsoft Windows), Mac, Wii U, PlayStation 4, Xbox One
MORDHAU;69,586;$29.99;0;Fighting;Triternion;82.25;MORDHAU;N/A;29-04-2019;Unreal Engine;PC (Microsoft Windows)
Stellaris;69,352;$9.99;-75%;Real Time Strategy (RTS);Paradox Development Studio;78.54545454545455;Stellaris: Console Edition;N/A;09-05-2016;Clausewitz Engine;Linux, PC (Microsoft Windows), Mac, PlayStation 4, Xbox One
Portal;68,420;$9.99;0;Real Time Strategy (RTS);Blizzard Entertainment;N/A;"WC2:BtDP, WarCraft II: The Dark Saga, Warcraft 2: The Dark Saga
, Warcraft IIWarcraft 2Warcraft 2: Beyond the Dark Portal, Warcraft 2: Beyond the Dark Portal, Warcraft 2, Warcraft 2: Beyond the Dark Portal, Warcraft II";Warcraft;30-04-1996;N/A;PC (Microsoft Windows), PlayStation, DOS, Mac, Sega Saturn
The Long Dark;68,217;$29.99;0;Shooter;Hinterland Studio Inc.;82.0;더 롱 다크;N/A;01-08-2017;Unity;Linux, PC (Microsoft Windows), Mac, PlayStation 4, Xbox One, Nintendo Switch
Killing Floor 2;65,746;$29.99;0;Shooter;Tripwire Interactive;80.76923076923077;KF2, 킬링 플로어 2, 킬플2;Killing Floor;18-11-2016;Unreal Engine 3;PC (Microsoft Windows), PlayStation 4, Xbox One
Tom Clancy's The Division;64,100;$29.99;0;Shooter;Ubisoft Red Storm;79.81818181818181;톰 클랜시의 디비전, 톰 클랜시의 더 디비전, ディビジョン, The Division;The Division;08-03-2016;Snowdrop;PC (Microsoft Windows), PlayStation 4, Xbox One
Grand Theft Auto IV: The Complete Edition;63,245;$19.99;0;Shooter;Rockstar North;N/A;Grand Theft Auto 4: Complete Edition, GTA IV: Complete Edition, GTA 4: Complete Edition, GTA IV Complete Edition, GTA 4 Complete Edition;Grand Theft Auto;27-10-2010;N/A;PC (Microsoft Windows), PlayStation 3, Xbox 360
Age of Empires II: Definitive Edition;62,838;$19.99;0;Real Time Strategy (RTS);Xbox Game Studios;77.66666666666667;AOE2:DE, Age of Empires II: édition définitive, Age of Empires II: Edição Definitiva, エイジ オブ エンパイアII：Definitive Edition, 에이지 오브 엠파이어 II : 결정판, AOE 2 Definitive Edition , Phoenix, 帝国时代 II：决定版, AoE2 4K;Age of Empires;14-11-2019;Genie Engine;PC (Microsoft Windows), Xbox One, Xbox Series X|S
ASTRONEER;62,004;$29.99;0;Simulator;System Era Softworks;80.75;アストロニーア;N/A;06-02-2019;Unreal Engine;PC (Microsoft Windows), PlayStation 4, Xbox One, Nintendo Switch
The Elder Scrolls V: Skyrim Special Edition;61,541;$39.99;0;Role-playing (RPG);Bethesda Game Studios;81.6842105263158;Skyrim Special Edition, SSE;The Elder Scrolls;28-10-2016;Creation Engine;PC (Microsoft Windows), PlayStation 4, Xbox One, PlayStation 5, Xbox Series X|S
XCOM 2;60,998;$59.99;0;Role-playing (RPG);2K Games;77.75;XCOM 2 컬렉션, XCOM 2 コレクション;X-COM;01-02-2018;Unreal Engine 3;Linux, PC (Microsoft Windows), Mac, iOS, PlayStation 4, Xbox One, Nintendo Switch
Cuphead;60,716;$19.99;0;Shooter;Studio MDHR;86.88235294117646;컵헤드, カップヘッド;N/A;29-09-2017;Unity;PC (Microsoft Windows), Mac, PlayStation 4, Xbox One, Nintendo Switch
Europa Universalis IV;60,429;$39.99;0;Real Time Strategy (RTS);Paradox Interactive;85.0;EU4, Europa Universalis 4;Europa Universalis;13-08-2013;Clausewitz Engine;Linux, PC (Microsoft Windows), Mac
Total War: WARHAMMER II;60,236;$59.99;0;Real Time Strategy (RTS);The Creative Assembly;87.875;Total War: Warhammer 2;Total War: Warhammer;28-09-2017;TW Engine 3;Linux, PC (Microsoft Windows), Mac
Hunt: Showdown;59,954;$39.99;0;Shooter;Crytek Frankfurt;74.8;헌트: 쇼다운, Hunt: Horrors of the Gilded Age;N/A;27-08-2019;CryEngine;PC (Microsoft Windows), PlayStation 4, Xbox One
Deep Rock Galactic;59,745;$29.99;0;Shooter;Ghost Ship Games;81.83333333333333;딥 락 갤럭틱;N/A;13-05-2020;Unreal Engine 4;PC (Microsoft Windows), PlayStation 4, Xbox One, PlayStation 5, Xbox Series X|S
Dead Cells;59,194;$24.99;0;Platform;Motion Twin;90.08333333333333;데드 셀 (Dead Cells);N/A;07-08-2018;Heaps.io;Linux, PC (Microsoft Windows), Mac, Android, iOS, PlayStation 4, Xbox One, Nintendo Switch
STAR WARS Jedi: Fallen Order™;58,175;$39.99;0;Adventure;Respawn Entertainment;82.84615384615384;Jedi: Fallen Order, Star Wars Jedi: Ordem Caída, スターウォーズジェダイ：フォールンオーダー, 星球大战绝地武士：堕落秩序, Star Wars Jedi: Gefallene Ordnung, 스타워즈 제다이: 오더의 몰락, 星際大戰 絕地：組織殞落, 스타워즈 제다이: 오더의 몰락™, STAR WARS Jedi: Fallen Order™;Star Wars Jedi;15-11-2019;Unreal Engine 4;PC (Microsoft Windows), PlayStation 4, Xbox One, PlayStation 5, Xbox Series X|S, Google Stadia
American Truck Simulator;57,426;$19.99;0;Racing;SCS Software;81.0;ATS;Euro Truck Simulator;03-02-2016;Prism3D;Linux, PC (Microsoft Windows), Mac
Oxygen Not Included;57,281;$12.49;-50%;Simulator;Klei Entertainment;N/A;산소미포함;N/A;30-07-2019;N/A;Linux, PC (Microsoft Windows), Mac
theHunter: Call of the Wild™;56,896;$19.99;0;Shooter;Avalanche Studios;73.6;The Hunter: Call of the Wild, theHunter: Call of the Wild;theHunter;16-02-2017;Apex;PC (Microsoft Windows), PlayStation 4, Xbox One
This War of Mine;56,525;$19.99;0;Simulator;11 bit studios;N/A;This War of Mine - War Child Charity, This War of Mine: War Child, This War of Mine - War Child;N/A;09-03-2015;N/A;Linux, PC (Microsoft Windows), Mac
BeamNG.drive;54,391;$24.99;0;Racing;BeamNG;N/A;BeamNG Drive, Drive;N/A;05-04-2015;Torque 3D;PC (Microsoft Windows)
Wolcen: Lords of Mayhem;54,332;$39.99;0;Role-playing (RPG);Wolcen Studio;58.0;Umbra;N/A;13-02-2020;CryEngine;PC (Microsoft Windows), PlayStation 4, Xbox One, PlayStation 5, Xbox Series X|S
Borderlands 3;53,798;$19.79;-67%;Shooter;2K Games;81.84615384615384;보더랜드 3, 无主之地3, ボーダーランズ 3;Borderlands;13-09-2019;Unreal Engine 4;PC (Microsoft Windows), Mac, PlayStation 4, Xbox One, PlayStation 5, Xbox Series X|S, Google Stadia
Black Mesa;53,172;$19.99;0;Shooter;Crowbar Collective;87.66666666666667;Black Mesa: Source;Half-Life;06-03-2020;Source;Linux, PC (Microsoft Windows)
For Honor;53,082;$14.99;0;Fighting;Ubisoft Montreal;N/A;For Honor: Season 21, For Honor: Year 6 - Season 21, For Honor: Y6S21, For Honor: Golden Age, For Honor Y6S1: Golden Age;N/A;17-03-2022;N/A;PC (Microsoft Windows), PlayStation 4, Xbox One
Ori and the Will of the Wisps;52,332;$29.99;0;Platform;Xbox Game Studios;90.75;精灵与萤火意志, オリアンドウィルオブザウィスプス;Ori;17-09-2020;Unity;PC (Microsoft Windows), Xbox One, Nintendo Switch, Xbox Series X|S
Insurgency: Sandstorm;51,601;$14.99;-50%;Shooter;Focus Entertainment;77.33333333333333;인서전시: 샌드스톰;Insurgency;12-12-2018;Unreal Engine;PC (Microsoft Windows), PlayStation 4, Xbox One
Kingdom Come: Deliverance;51,561;$29.99;0;Role-playing (RPG);Deep Silver;73.72727272727273;킹덤 컴: 딜리버런스, KCD;N/A;13-02-2018;CryEngine;PC (Microsoft Windows), PlayStation 4, Xbox One, Nintendo Switch
Elite Dangerous;50,341;$29.99;0;Shooter;Frontier Developments;81.95238095238095;Elite 4, Elite: Dangerous Horizons, Elite Dangerous, Elite: Dangerous (Game Preview), Elite 4;Elite;12-05-2015;COBRA;PC (Microsoft Windows), Mac, PlayStation 4, Xbox One, Windows Mixed Reality, SteamVR, Oculus Rift
Totally Accurate Battle Simulator;50,229;$14.99;0;Fighting;Landfall Games;N/A;TABS, 토탈리 어큐레이트 배틀 시뮬레이터;Totally Accurate;01-04-2021;Unity;PC (Microsoft Windows), Mac, Xbox One, Nintendo Switch
Frostpunk;50,146;$29.99;0;Simulator;11 bit studios;86.22222222222223;프로스트펑크;Frostpunk;24-04-2018;Liquid Engine;PC (Microsoft Windows), Mac, PlayStation 4, Xbox One
Saints Row IV;50,127;$14.99;0;Shooter;High Voltage Software;84.14285714285714;Saints Row IV: Re-Elected, Saints Row 4, Saints Row The Third - Enter the Dominatrix, The Next Great Sequel in the Saints Row Franchise, The Next Great Sequel in the Saints Row Franchise, Saints Row 4, Saints Row The Third - Enter the Dominatrix;Saints Row;20-08-2013;Custom built engine;PC (Microsoft Windows), PlayStation 3, Xbox 360, PlayStation 4, Xbox One
Hotline Miami;50,035;$9.99;0;Shooter;Dennaton Games;86.2;HM;Hotline Miami;23-10-2012;GameMaker: Studio;Linux, PC (Microsoft Windows), PlayStation 3, Mac, Android, PlayStation Vita, PlayStation 4, Xbox One, Nintendo Switch, Google Stadia
Enter the Gungeon;49,912;$14.99;0;Shooter;Dodge Roll;82.46153846153847;ETG, エンター・ザ・ガンジョン, Enter the Gungeon: Advanced Gungeons & Dragons;Gungeon;05-04-2016;Unity;Linux, PC (Microsoft Windows), Mac, PlayStation 4, Xbox One, Nintendo Switch, Google Stadia
Grand Theft Auto: San Andreas;47,227;$14.99;0;Shooter;Rockstar North;93.14285714285714;GTA: SA, GTA: San Andreas, San Andreas, GTA San Andreas, Grand Theft Auto: Сан Андреас;Grand Theft Auto;26-10-2004;RenderWare;PC (Microsoft Windows), PlayStation 2, PlayStation 3, Xbox, Xbox 360, Mac, Android, iOS, PlayStation 4
Friday the 13th: The Game;47,125;$14.99;0;Indie;Illfonic;60.875;Slasher Vol. 1: Summer Camp;Friday the 13th;26-05-2017;Unreal Engine;PC (Microsoft Windows), PlayStation 4, Xbox One, Nintendo Switch
