Game title;Amount of recommendations;Current price;Current discount;Genre;Publisher;Rating;Names;Collection;Release;engine;Platforms
DARK;618;$9.99;0;Simulator;Looking Glass Studios;70.0;Thief: o Projeto Negro, Dark Project - L'Ombra del Ladro, Dark project : La guilde des voleurs, Dark Project - Der Meisterdieb, The Dark, Dark Camelot;Thief;30-11-1998;Dark Engine;PC (Microsoft Windows)
Angry Video Game Nerd II: ASSimilation;616;$9.99;0;Shooter;FreakZone Games;72.5;AVGN II: ASSimilation, Angry Video Game Nerd II: ASSimilation;AVGN Adventures;29-03-2016;N/A;Linux, PC (Microsoft Windows), Mac
Frontlines: Fuel of War;616;$19.99;0;Shooter;THQ;76.0;프론트라인: 최후의자원전쟁;N/A;25-02-2008;Unreal Engine;PC (Microsoft Windows), Xbox 360
Peggle Nights;616;$4.99;0;Puzzle;PopCap Games;84.0;페글 나이츠;Peggle;03-09-2008;N/A;PC (Microsoft Windows), Mac
KILL la KILL -IF;615;$9.99;-50%;Fighting;APLUS Co., Ltd.;57.0;Kill la Kill The Game, Kill la Kill The Game: IF, 킬라킬 더 게임 -IF-, キルラキル ザ・ゲーム -異布-, キルラキル ザ・ゲーム 異布, KILL la KILL: IF;N/A;25-07-2019;N/A;PC (Microsoft Windows), PlayStation 4, Nintendo Switch
TO THE TOP;615;$19.99;0;Sport;VRIDGE;N/A;Shin Tennis no Ouji-sama ~Go to the Top~, 新テニスの王子様 ~Go to the top~, The Prince of Tennis: Go to the Top, Shin Tennis no Oji-sama: Go to the Top;N/A;05-03-2015;N/A;Nintendo 3DS
Megadimension Neptunia VIIR;614;$29.99;0;Role-playing (RPG);Idea Factory;83.0;新次元ゲイム ネプテューヌVIIR (ビクトリィーツーリアライズ), Shin Jigen Game Neptune VIIR (Victory II Realize), Megadimension Neptunia VIIR (Victory II Realize), 신차원게임 넵튠 VⅡR;Hyperdimension Neptunia;24-08-2017;N/A;PC (Microsoft Windows), PlayStation 4, Nintendo Switch
Haydee 2;613;$24.99;0;Shooter;Haydee Interactive;N/A;Haydee II;Haydee;23-11-2020;HDAurora;PC (Microsoft Windows)
Nom Nom Galaxy;613;$9.99;0;Platform;Q-Games Ltd.;71.66666666666667;Nom Nom Galaxy, Pixel Junk NomNom Galaxy, PixelJunk 1-6, PixelJunk Inc.;PixelJunk;03-08-2015;N/A;PC (Microsoft Windows), PlayStation 4
The Colonists;612;$24.99;0;Simulator;Codebyfire;80.0;ザ・コロニスト;N/A;24-10-2018;N/A;Linux, PC (Microsoft Windows), Mac, PlayStation 4, Xbox One, Nintendo Switch
Delivery From The Pain;611;$7.99;0;Shooter;DigiPotato Studio;N/A;末日方舟 DeliveryFromThePain;N/A;12-06-2019;N/A;PC (Microsoft Windows), PlayStation 4, Nintendo Switch
qop;610;$0.99;0;Puzzle;Quiet River;N/A;qop;qop;13-07-2017;N/A;PC (Microsoft Windows)
BIT.TRIP BEAT;609;$9.99;0;Music;Aksys Games;80.0;BIT.TRIP BEAT;Bit.Trip;02-11-2010;N/A;Linux, Wii, PC (Microsoft Windows), Mac, Android, Nintendo 3DS, iOS, Nintendo Switch
The Path;609;$9.99;0;Fighting;Atari;65.6;Matrix: Path Of Neo, Matrix: Path Of Neo;The Matrix;04-10-2005;N/A;PC (Microsoft Windows), PlayStation 2, Xbox
theHunter Classic;606;$0.00;0;Shooter;Expansive Worlds;66.66666666666667;theHunter, The Hunter, theHunter Classic;N/A;03-06-2014;N/A;PC (Microsoft Windows)
Bridge Constructor;605;$9.99;0;Puzzle;Headup Games;65.875;Bridge Constructor FREE;Bridge Constructor;16-10-2013;N/A;Linux, PC (Microsoft Windows), Mac, Android, iOS, PlayStation Vita, PlayStation 4, Xbox One, Windows Phone
King's Bounty: Armored Princess;605;$9.99;0;Role-playing (RPG);Katauri Interactive;90.0;King's Bounty: Принцесса в доспехах, キングズ バウンティ アーマード プリンセス;King's Bounty;18-04-2012;TheEngine;PC (Microsoft Windows), Mac
Rogue Stormers;604;$19.99;0;Shooter;Black Forest Games;57.5;Dieselstörmers;N/A;21-04-2016;Custom built engine;PC (Microsoft Windows), PlayStation 4, Xbox One
Birthdays the Beginning;603;$9.99;0;Simulator;Arc System Works;70.6;Happy Birthdays;N/A;19-01-2017;N/A;PC (Microsoft Windows), PlayStation 4, Nintendo Switch
Q.U.B.E. 2;603;$24.99;0;Platform;Toxic Games;72.83333333333333;QUBE 2;Q.U.B.E.;13-03-2018;N/A;PC (Microsoft Windows), PlayStation 4, Xbox One, Nintendo Switch
NiGHTS into Dreams...;603;$7.99;0;N/A;Success Corporation;N/A;Fantastic Night Dreams: Cotton, Cotton;Cotton;01-03-1991;N/A;PlayStation, Arcade, TurboGrafx-16/PC Engine, Neo Geo Pocket, Neo Geo Pocket Color, Sharp X68000, Turbografx-16/PC Engine CD
Everlasting Summer;602;$0.00;0;Adventure;Soviet Games;N/A;Бесконечное лето;N/A;19-11-2014;Ren'Py Visual Novel Engine;Linux, PC (Microsoft Windows), Mac, Android
PAYDAY: Wolf Pack;602;$9.99;0;Shooter;Overkill Software;N/A;PAYDAY: Wolf Pack;Payday;04-05-2013;N/A;PC (Microsoft Windows)
Flying Tigers: Shadows Over China;601;$14.99;0;Simulator;Ace Maddox;N/A;Ø  フライングタイガーズ　中国の空を駆ける影;N/A;29-05-2017;N/A;PC (Microsoft Windows), Xbox One
Jamestown;601;$9.99;0;Shooter;Final Form Games;91.5;Jamestown Plus;N/A;18-03-2015;N/A;PC (Microsoft Windows), PlayStation 4, Nintendo Switch
Sid Meier's Civilization IV: Colonization;601;$7.49;-75%;Simulator;Firaxis Games;77.33333333333333;Sid Meier's Civilization 4: Colonization, Sid Meier's Civilization 4: Colonization;Civilization;22-09-2008;N/A;PC (Microsoft Windows), Mac
MotoGP™13;599;$9.99;0;Racing;Plug In Digital;78.33333333333333;MotoGP 13, MotoGP 13;MotoGP;20-06-2013;N/A;PC (Microsoft Windows), PlayStation 3, Xbox 360, PlayStation Vita
Wonderful Everyday Down the Rabbit-Hole;598;$29.99;0;Adventure;KeroQ;N/A;SubaHibi, Subarashiki Hibi ~Furenzoku Sonzai~, 素晴らしき日々 ～不連続存在～, Wonderful Everyday: Discontinuous Existence, すば日々;N/A;26-03-2010;N/A;PC (Microsoft Windows)
PAYDAY 2: The Golden Grin Casino Heist;598;$2.99;0;Shooter;Lion Game Lion;N/A;PAYDAY 2: The Golden Grin Casino Heist;N/A;25-06-2015;N/A;PC (Microsoft Windows), PlayStation 4, Xbox One
Resident Evil 7 Teaser: Beginning Hour;597;$0.00;0;Adventure;Capcom;N/A;バイオハザード7 ティザー ～ビギニングアワー～;Resident Evil;19-12-2016;RE Engine;PC (Microsoft Windows), PlayStation 4, Xbox One
Return to Shironagasu Island;596;$4.99;0;Adventure;HYOGO ONIMUSHI;N/A;シロナガス島への帰還 -Return to Shironagasu Island-, 重返蓝鲸岛 -Return to Shironagasu Island-, Retour sur l'île de Shironagasu;N/A;26-02-2020;N/A;PC (Microsoft Windows), Nintendo Switch
Tcheco in the Castle of Lucio;596;$0.99;0;Platform;Marcelo Barbosa;N/A;Tcheco no Castelo do Sarney, Tcheco no Castelo do Sarney EX Plus Alpha Zero X Gold 1;Tcheco;22-06-2015;N/A;PC (Microsoft Windows), PlayStation 4, Xbox One, Nintendo Switch
Halo 3: ODST;595;$4.99;0;Shooter;Bungie;77.66666666666667;Halo 3: Recon, Halo 3: Recon, 헤일로3 ODST;Halo;22-09-2009;Halo 3;PC (Microsoft Windows), Xbox 360, Xbox One
AaAaAA!!! - A Reckless Disregard for Gravity;595;$9.99;0;Simulator;Dejobaan Games, LLC;90.0;Low Altitude, AaAaAA!!! - A Reckless Disregard for Gravity, Aaaaa!;AaaaaAAaaaAAAaaAAAAaAAAAA!!!;03-09-2009;N/A;PC (Microsoft Windows)
EARTH DEFENSE FORCE: IRON RAIN;593;$59.99;0;Shooter;D3 Publisher;72.11111111111111;EDF: Iron Rain;Earth Defense Force;11-04-2019;N/A;PC (Microsoft Windows), PlayStation 4
Anno 1404 - History Edition;592;$14.99;0;Simulator;Ubisoft Blue Byte;N/A;Anno 1404 History Edition, Anno 1404 - History Edition;Anno;25-06-2020;N/A;PC (Microsoft Windows)
LISA the Joyful;592;$4.99;0;Role-playing (RPG);Dingaling;N/A;LISA the Joyful;LISA;24-08-2015;N/A;Linux, PC (Microsoft Windows), Mac
Super Time Force Ultra;592;$14.99;0;Shooter;Capybara Games;N/A;スーパータイムフォース ＵＬＴＲＡ, スーパータイムフォース ULTRA;N/A;14-05-2014;N/A;PC (Microsoft Windows), Xbox 360, PlayStation Vita, PlayStation 4, Xbox One
Kero Blaster;589;$9.99;0;Shooter;Studio Pixel;76.25;ケロブラスター;N/A;11-05-2014;N/A;PC (Microsoft Windows), iOS, PlayStation 4, Nintendo Switch
Port Royale 4;588;$49.99;0;Simulator;Kalypso Media Digital;50.0;포트 로얄 4, ポート ロイヤル 4 , ポート ロイヤル 4;Port Royale;25-09-2020;N/A;PC (Microsoft Windows), PlayStation 4, Xbox One, Nintendo Switch, PlayStation 5, Xbox Series X|S
YOU and ME and HER: A Love Story;587;$29.99;0;Adventure;Nitroplus;N/A;Kimi to Kanojo to Kanojo no Koi., 君と彼女と彼女の恋。, Totono;N/A;28-06-2013;N/A;PC (Microsoft Windows)
Silent Hunter: Wolves of the Pacific;587;$9.99;0;Simulator;Ubisoft Bucharest;80.0;SH4Silent Hunter 4, Silent Hunter 4, SH4;Silent Hunter;20-03-2007;N/A;PC (Microsoft Windows)
theHunter: Call of the Wild™ - Vurhonga Savanna;585;$7.99;0;Simulator;Expansive Worlds;N/A;theHunter: Call of the Wild - Vurhonga Savanna;N/A;30-08-2018;N/A;PC (Microsoft Windows), Xbox One
Nurse Love Addiction;585;$39.99;0;Simulator;Degica Games;85.0;Hakuisei Aijou Izonshou;N/A;07-07-2016;N/A;PC (Microsoft Windows), PlayStation Vita, Nintendo Switch
GIBZ;584;$7.99;0;Shooter;Torrunt;75.0;GIBZ;N/A;07-04-2017;N/A;PC (Microsoft Windows)
What The Box?;582;$4.99;0;N/A;Game Freak;N/A;ポケモンボックス ルビー＆サファイア, Pokémon Box : Rubis & Saphir, Pokémon Box: Rubin und Saphir, Pokémon Box: Rubino e Zaffiro, Pokémon Box: Rubí y Zafiro, Pokemon Box;N/A;30-05-2003;N/A;Nintendo GameCube
Xeodrifter™;582;$9.99;0;Platform;Renegade Kid;79.0;XEODRIFTER(ゼオドリフター), ゼオドリフター;N/A;11-12-2014;N/A;PC (Microsoft Windows), Nintendo 3DS, Wii U, PlayStation Vita, PlayStation 4, Nintendo Switch
Perpetuum;582;$4.99;0;Role-playing (RPG);Avatar Creations;N/A;Perpetuum Online;N/A;05-09-2014;N/A;PC (Microsoft Windows)
Commandos: Beyond the Call of Duty;579;$4.99;0;Strategy;Pyro Studios;66.0;קומנדו: משימות מעבר לחובותיך, Commandos: Um Chamado do Dever, Commandos. Mas allá del deber, Commandos : Le sens du devoir, Commandos: Im Auftrag der Ehre, Commandos: Dietro le linee nemiche;Commandos;31-07-1999;N/A;PC (Microsoft Windows)
Evoland Legendary Edition;578;$19.99;0;Role-playing (RPG);Shiro Games;92.0;에보랜드: 레전더리 에디션, エボランド：レジェンダリーコレクション;Evoland;07-02-2019;Heaps.io;Linux, PC (Microsoft Windows), Mac, PlayStation 4, Xbox One, Nintendo Switch
Total War: ROME II - Rise of the Republic Campaign Pack;577;$16.99;0;Strategy;CREATIVE ASSEMBLY;N/A;Total War: ROME II - Rise of the Republic Campaign Pack;N/A;09-08-2018;N/A;PC (Microsoft Windows)
SpyParty;577;$24.99;0;Simulator;Chris Hecker;N/A;Spy Party;N/A;12-04-2018;N/A;PC (Microsoft Windows)
Total War: WARHAMMER - The Grim and the Grave;575;$8.99;0;Strategy;Sega;N/A;Total War: Warhammer - The Grim & The Grave;Total War: Warhammer;01-09-2016;N/A;Linux, PC (Microsoft Windows), Mac
Tracks - The Train Set Game;573;$19.99;0;Racing;Excalibur Games;N/A;Tracks, Tracks - The Family Friendly Open World Train Set Game;N/A;14-11-2019;N/A;PC (Microsoft Windows), Xbox One
Going Under;570;$19.99;0;Adventure;OVERDRIVE;N/A;Go! Go! Nippon! ~My First Trip to Japan~ 2016, Go! Go! Nippon! My First Trip to Japan 2016, Go! Go! Japan! 2016, ゴー！ゴー！ニッポン！2016, ゴー！ゴー！ニッポン！2016;Go! Go! Nippon!;11-11-2016;Unity;PC (Microsoft Windows)
Driver: Parallel Lines;570;$9.99;0;Shooter;Atari;66.33333333333333;Driver® Parallel Lines;Driver;26-06-2007;N/A;Wii, PC (Microsoft Windows), PlayStation 2, Xbox
GRANDIA HD Remaster;569;$19.99;0;Role-playing (RPG);GungHo Online Entertainment, Inc.;N/A;Grandia I HD Remaster;Grandia;15-10-2019;N/A;PC (Microsoft Windows), Nintendo Switch
Double Dragon IV;569;$6.99;0;Fighting;Arc System Works;49.77777777777778;DD4, Double Dragon 4, ダブルドラゴン４, 더블 드래곤 4;Double Dragon;30-01-2017;N/A;PC (Microsoft Windows), PlayStation 4, Xbox One, Nintendo Switch
L.A. Noire: The VR Case Files;567;$29.99;0;Puzzle;Rockstar Games;83.75;L.A.ノワール: VR事件簿;N/A;15-12-2017;N/A;PC (Microsoft Windows), PlayStation VR
VenusBlood FRONTIER International;566;$39.99;0;Role-playing (RPG);Ninetail;N/A;VenusBlood FRONTIER International;N/A;08-02-2020;N/A;PC (Microsoft Windows)
Age of Empires II (2013): The African Kingdoms;566;$9.99;0;Real Time Strategy (RTS);Xbox Game Studios;N/A;Age of Empires II (2013): The African Kingdoms;N/A;05-11-2015;N/A;PC (Microsoft Windows)
David.;566;$1.99;0;Platform;Fermenter Games;N/A;David.;N/A;16-02-2015;N/A;PC (Microsoft Windows), Mac
hackmud;564;$19.99;0;Puzzle;Drizzly Bear;N/A;ｈａｃｋｍｕｄ, hackmud;N/A;22-09-2016;Unity;Linux, PC (Microsoft Windows), Mac
Atelier Ryza 2: Lost Legends & the Secret Fairy;563;$59.99;0;Role-playing (RPG);Koei Tecmo Games;82.33333333333333;라이자의 아틀리에2 ~잃어버린 전승과 비밀의 요정~, 莱莎的炼金工房２ ～失落传说与秘密妖精～, 萊莎的鍊金工房２ ～失落傳說與秘密妖精～, Atelier Ryza 2, Atelier Ryza 2: Lost Legends & the Secret Fairy, ライザのアトリエ２ ～失われた伝承と秘密の妖精～, ライザのアトリエ２ 失われた伝承と秘密の妖精;Atelier Ryza;29-01-2021;N/A;PC (Microsoft Windows), PlayStation 4, Nintendo Switch, PlayStation 5
KNIGHTS;563;$0.99;0;Shooter;LucasArts;N/A;Star Wars: Jedi Knight, Guerra nas Estrelas: Jedi Knight - Dark Forces II: O Cavaleiro Jedi, JKDF2, JKDFII, Star Wars: Jedi Knight - Dark Forces 2, Dark Forces 2, Star Wars: Jedi Knight - Dark Forces 2, JKDF2, JKDFII;Star Wars: Jedi Knight;30-09-1997;Sith;PC (Microsoft Windows)
PAYDAY 2: The Point Break Heists;562;$2.99;0;Shooter;505 Games;N/A;PAYDAY 2: The Point Break Heists;N/A;03-12-2015;N/A;PC (Microsoft Windows)
Chantelise;562;$9.99;0;Role-playing (RPG);EasyGameStation;N/A;シャンテリーゼ;N/A;31-12-2006;N/A;Linux, PC (Microsoft Windows)
The Last NightMary - A Lenda do Cabeça de Cuia;561;$3.99;0;Point-and-click;Submersivo Game Studio;N/A;The Last NightMary: A Lenda do Cabeca de Cuia;N/A;02-11-2015;N/A;Linux, PC (Microsoft Windows), Mac
Beyond Blue;560;$19.99;0;Simulator;E-Line Media;69.75;ビヨンドゥブルー;N/A;17-04-2020;Unity 5;PC (Microsoft Windows), iOS, PlayStation 4, Xbox One, Nintendo Switch
沉睡的法则 Things as They Are;559;$4.19;-30%;Role-playing (RPG);四块二茶会;N/A;沉睡的法则;N/A;18-06-2019;N/A;PC (Microsoft Windows)
NOBUNAGA'S AMBITION: Taishi;559;$59.99;0;Simulator;Koei Tecmo Games;80.0;信長の野望･大志;Nobunaga's Ambition;30-11-2017;N/A;PC (Microsoft Windows), PlayStation 4, Nintendo Switch
BREAK ARTS II;559;$14.99;0;Racing;PLAYISM;60.0;Break Arts 2, BREAK ARTS II;N/A;09-02-2018;N/A;PC (Microsoft Windows), PlayStation 4
Mists of Aiden;558;$6.99;0;Adventure;Steppe Hare Studio;N/A;House On The Hill;N/A;29-07-2020;N/A;PC (Microsoft Windows)
Murder House;558;$11.99;0;Adventure;Puppet Combo;N/A;殺しの館;N/A;23-10-2020;N/A;PC (Microsoft Windows), PlayStation 4, Xbox One, Nintendo Switch
Broken Sword 2 - the Smoking Mirror: Remastered;558;$5.99;0;Point-and-click;Revolution Software;N/A;Broken Sword II: Las Fuerzas del Mal - Remasterizado, Baphomets Fluch II: Die Spiegel der Finsternis - Remastered, Broken Sword II: La Profezia dei Maya - Rimasterizatto, Broken Sword II: Дымящееся зеркало. Расширенное издание, Les Chevaliers de Baphomet : Les Boucliers de Quetzalcoatl - Remasterisé, Broken Sword II: The Smoking Mirror - Remastered, Broken Sword 2: Remastered;Broken Sword;02-12-2009;N/A;Linux, PC (Microsoft Windows), Mac, Android, iOS
Dragon Marked For Death;557;$39.99;0;Role-playing (RPG);Inti Creates;67.0;Dragon Marked For Deathオールインワンパック, Dragon Marked For Death オールインワンパック;N/A;31-01-2019;N/A;PC (Microsoft Windows), PlayStation 4, Nintendo Switch
Borderlands 2 VR;555;$19.99;-60%;Shooter;2K Games;60.25;ボーダーランズ®2 VR, ボーダーランズ 2 VR;Borderlands;14-12-2018;N/A;SteamVR, PlayStation VR
FINAL FANTASY XV EPISODE ARDYN;555;$4.99;0;Role-playing (RPG);Square Enix;N/A;FFXV: Episode Ardyn, FFXV エピソード アーデン, FFXV 에피소드 아덴;Final Fantasy;26-03-2019;Luminous Studio;PC (Microsoft Windows), PlayStation 4, Xbox One
Gunman Clive;555;$1.99;0;Shooter;Horberg Productions;80.0;Gunman Story, Gunman Story, ガンマンストーリー;Gunman Clive;03-01-2013;N/A;PC (Microsoft Windows), Android, Nintendo 3DS, iOS
Gift Girl;554;$0.79;-60%;Role-playing (RPG);Imageepoch;N/A;闘神都市;N/A;30-01-2014;N/A;Nintendo 3DS
Earth 2160;553;$4.99;0;Real Time Strategy (RTS);Reality Pump;77.5;Земля 2160;Earth 2140;02-08-2005;Earth-4;Linux, PC (Microsoft Windows), Mac
Baldr Sky;552;$49.99;0;Hack and slash/Beat 'em up;Giga;N/A;"バルドスカイ ゼロ 2, Baldr Sky ""Zero"" 2";Baldr;28-03-2014;NeXAS;PC (Microsoft Windows)
DoDonPachi Resurrection;552;$29.99;0;Shooter;Rising Star Games;75.5;DoDonPachi DaiFukkatsu, 怒首領蜂 大復活;Dodonpachi;22-05-2008;N/A;PC (Microsoft Windows), Xbox 360, Android, iOS, Arcade, Nintendo Switch
Toki Tori 2+;552;$14.99;0;Platform;Two Tribes;75.33333333333333;Toki Tori II, Toki Tori 2+, Toki Tori 2+: Himerareta Nazo to Fushigi na Shima, Toki Tori 2+, Toki Tori II;Toki Tori;04-04-2013;Proprietary Engine;PC (Microsoft Windows), Mac, Wii U
Rome: Total War - Alexander;552;$12.99;0;Simulator;The Creative Assembly;70.0;Total War: Rome - Alexander;N/A;19-06-2006;N/A;PC (Microsoft Windows), iOS
Atelier Firis: The Alchemist and the Mysterious Journey;551;$59.99;0;Role-playing (RPG);Gust;76.66666666666667;フィリスのアトリエ ～不思議な旅の錬金術士～, Firis no Atelier: Fushigi na Tabi no Renkinjutsushi, 피리스의 아틀리에 ~신비한 여행의 연금술사~;Atelier: Mysterious;02-11-2016;N/A;PC (Microsoft Windows), PlayStation Vita, PlayStation 4
The Walking Dead: The Telltale Definitive Series;549;$49.99;0;Point-and-click;Skybound Games;77.5;The Telltale Definitive Series: The Walking Dead;The Walking Dead - A Telltale Games Series;10-09-2019;N/A;PC (Microsoft Windows), PlayStation 4, Xbox One
Phantom Rose;549;$14.99;0;Role-playing (RPG);Studio Maka;N/A;Phantom ROse Mobile, Phantom Rose Mobile;N/A;03-12-2020;N/A;Android, iOS
Constructor;549;$29.99;0;Simulator;System 3 Software;N/A;Constructor HD;N/A;31-12-2018;N/A;PC (Microsoft Windows), PlayStation 4, Xbox One, Nintendo Switch
Painkiller Overdose;549;$4.99;0;Shooter;Mindware Studios;50.33333333333334;Painkiller: Передозировка;Painkiller;30-10-2007;Havok;PC (Microsoft Windows)
MarZ: Tactical Base Defense;548;$21.99;0;Strategy;doorfortyfour;N/A;Marz Rising;N/A;26-09-2017;N/A;PC (Microsoft Windows)
Frederic: Evil Strikes Back;548;$7.99;0;Music;Forever Entertainment S. A.;N/A;ショパンの復活　悪魔の逆襲！;Frederic;23-05-2014;N/A;Linux, PC (Microsoft Windows), Mac, iOS, Nintendo Switch
Total War: WARHAMMER II - The Shadow & The Blade;547;$9.99;0;Strategy;Sega;N/A;Total War: WARHAMMER II - The Shadow & The Blade;N/A;12-12-2019;N/A;PC (Microsoft Windows)
Nights of Azure;547;$29.99;0;Role-playing (RPG);Gust;66.33333333333333;Yoru no Nai Kuni, Yorunonaikuni , 밤이 없는 나라, よるのないくに;Nights of Azure;01-10-2015;N/A;PC (Microsoft Windows), PlayStation 3, PlayStation Vita, PlayStation 4
Capcom Beat 'Em Up Bundle;546;$19.99;0;Fighting;Capcom;73.66666666666667;Capcom Belt Action Collection, カプコン ベルトアクション コレクション, CAPCOM BEAT 'EM UP BUNDLE / CAPCOM BELT ACTION COLLECTION;N/A;18-09-2018;MT Framework;PC (Microsoft Windows), PlayStation 4, Xbox One, Nintendo Switch
Levelhead;546;$19.99;0;Platform;Butterscotch Shenanigans;85.0;Levelhead: Platformer Maker, LevelHead;N/A;18-04-2019;GameMaker Studio 2;PC (Microsoft Windows), Android, iOS, Xbox One, Nintendo Switch
DRONE The Game;545;$19.99;0;Racing;Five Studios Interactive;N/A;Drone THE GAME, D.R.O.N.E.;N/A;27-12-2018;N/A;PC (Microsoft Windows)
Accounting+;545;$4.79;-60%;Simulator;Limited Run;80.0;ACCOUNTING+, Accounting Plus, Accounting +;N/A;18-10-2018;N/A;SteamVR, PlayStation VR, Oculus Quest, Oculus Rift, Meta Quest 2
DRAGON QUEST HEROES™ II;545;$59.99;0;Role-playing (RPG);Omega Force;81.86666666666666;Dragon Quest Heroes 2, 드래곤 퀘스트 히어로즈 II 쌍둥이 왕과 예언의 끝, Dragon Quest Heroes II: Futago no Ou to Yogen no Owari, Dragon Quest Heroes II: Twin Kings and the Prophecy's End, ドラゴンクエストヒーローズII 双子の王と予言の終わり;Dragon Quest Heroes;27-05-2016;N/A;PC (Microsoft Windows), PlayStation 3, PlayStation Vita, PlayStation 4
Medieval II: Total War Kingdoms;544;$24.99;0;Strategy;The Creative Assembly;85.0;Total War: Medieval II - Kingdoms, Medieval 2: Total War - Kingdoms;N/A;28-08-2007;N/A;Linux, PC (Microsoft Windows), Mac
Hello Charlotte: Childhood's End;543;$2.99;0;Role-playing (RPG);etherane;N/A;Hello Charlotte Episode 3, Hello Charlotte: Childhood's End;Hello Charlotte;05-01-2018;RPG Maker;PC (Microsoft Windows)
Qbeh-1: The Atlas Cube;542;$9.99;0;Puzzle;Digital Tribe;N/A;QBEH-1: The Atlas Cube;N/A;15-05-2014;N/A;PC (Microsoft Windows), Mac
Death to Spies;542;$4.99;0;Shooter;Haggard Games;70.0;Смерть шпионам;Death to Spies;16-10-2007;N/A;PC (Microsoft Windows)
Sherlock Holmes versus Jack the Ripper;541;$9.99;0;Point-and-click;Focus Entertainment;66.0;Sherlock Holmes contre Jack l'Eventreur, Sherlock Holmes vs. Jack the Ripper, Sherlock Holmes versus Jack the Ripper;Sherlock Holmes;24-05-2009;N/A;PC (Microsoft Windows), Xbox 360
DOOM 3: Resurrection of Evil;541;$2.99;0;Shooter;Activision;74.5;RoE;Doom;04-04-2005;id Tech 4;Linux, PC (Microsoft Windows), Xbox
Industry Giant 2;540;$9.99;0;Simulator;Fancy Bytes;50.33333333333334;Industry Giant 2, Industry Giant 2;N/A;20-12-2016;N/A;PC (Microsoft Windows), PlayStation 4, Xbox One
Zeno Clash 2;540;$14.99;0;Fighting;ACE Team;54.5;Zeno Clash 2, Zeno Clash 2;Zeno Clash;30-04-2013;N/A;PC (Microsoft Windows), PlayStation 3, Xbox 360
Titanfall™;539;$19.99;0;Shooter;Electronic Arts;83.71428571428571;타이탄폴;Titanfall;11-03-2014;Source;PC (Microsoft Windows), Xbox 360, Xbox One
This War of Mine: Stories - Father's Promise;537;$1.99;0;Simulator;11 bit studios;70.0;This War of Mine: Father's Promise;N/A;14-11-2017;N/A;Linux, PC (Microsoft Windows), Mac
Arctico;536;$3.99;-60%;Adventure;Claudio Norori;N/A;Eternal Winter;N/A;24-11-2014;N/A;PC (Microsoft Windows), Mac
ARAYA;533;$14.99;0;Adventure;MAD Virtual Reality Studio;93.75;ARAYA;N/A;23-11-2016;Unity;PC (Microsoft Windows)
Sudeki;533;$5.99;0;Role-playing (RPG);Microsoft Game Studios;66.25;魔幻战士, Symphony of Light;N/A;20-07-2004;N/A;PC (Microsoft Windows), Xbox
Nitroplus Blasterz: Heroines Infinite Duel;532;$19.99;0;Fighting;Examu;71.66666666666667;ニトロプラス ブラスターズ -ヒロインズ インフィニット デュエル-, Nitroplus Blasterz: Heroine's Infinite Duel, Nitoropurasu Burasutāzu: Heroinzu Infinitto Dueru;N/A;30-04-2015;N/A;PC (Microsoft Windows), PlayStation 3, PlayStation 4, Arcade
Company of Heroes: Opposing Fronts;531;$19.99;0;Real Time Strategy (RTS);Relic Entertainment;82.0;CoH:OF, CoHOF;Company of Heroes;25-09-2007;Havok Physics;PC (Microsoft Windows)
PUSS!;530;$2.99;-70%;Puzzle;teamCOIL;N/A;PUSS!;N/A;02-08-2018;N/A;Linux, PC (Microsoft Windows), Mac, PlayStation 4, Xbox One, Nintendo Switch
Bionic Commando Rearmed;530;$9.99;0;Shooter;Capcom;88.85714285714286;BCR, 바이오닉 코만도 리암드;Bionic Commando;13-08-2008;Diesel;PC (Microsoft Windows), PlayStation 3, Xbox 360
Dead by Daylight - Cursed Legacy;529;$6.99;0;N/A;Starbreeze Publishing;N/A;Dead by Daylight: 呪われた遺産;Dead by Daylight;03-12-2019;N/A;PC (Microsoft Windows), Xbox One, Nintendo Switch
Detective Di: The Silk Rose Murders;528;$10.99;0;Point-and-click;Nupixo Games;N/A;디형사, ディ探偵;N/A;02-05-2019;N/A;PC (Microsoft Windows), Mac, Xbox One, Nintendo Switch
Dandelion - Wishes brought to you -;528;$29.99;0;Simulator;Sujin Ri;N/A;덴더라이언 ~너에게 부는 바람~, Dandelion ~Neoege Buneun Baram~, Dandelion –Wishes Brought to You–;N/A;01-08-2014;N/A;PC (Microsoft Windows), Mac
SMASHING THE BATTLE;527;$11.99;0;Fighting;Studio HG;N/A;SMASHING THE BATTLE（スマッシング・ザ・バトル）, スマッシング・ザ・バトル ;N/A;15-05-2016;N/A;PC (Microsoft Windows), Android, iOS, PlayStation 4, Nintendo Switch
VoidExpanse;527;$14.99;0;Role-playing (RPG);AtomicTorch Studio;N/A;Void Expanse;N/A;04-03-2015;N/A;Linux, PC (Microsoft Windows), Mac
Graviteam Tactics: Mius-Front;527;$34.99;0;Simulator;Graviteam;N/A;Graviteam Tactics: Mius-Front;Graviteam Tactics;04-03-2016;N/A;PC (Microsoft Windows)
Nameless ~The one thing you must recall~;525;$29.99;0;Simulator;Cheritz;N/A;Nameless ~Dangsin-i Gieoghaeya Hal Dan Hangajiui Geos~, 네임리스 ~당신이 기억해야 할 단 한가지의 것~;N/A;24-12-2014;N/A;PC (Microsoft Windows), Mac
Total War: WARHAMMER II - The Queen & The Crone;524;$9.99;0;Strategy;Sega;N/A;Total War: WARHAMMER II - The Queen & The Crone;N/A;31-05-2018;N/A;PC (Microsoft Windows)
VOI;524;$0.99;0;Puzzle;Yunus Ayyildiz;N/A;VOI;N/A;01-06-2016;N/A;PC (Microsoft Windows), Mac, iOS
GAROU: MARK OF THE WOLVES;524;$9.99;0;Fighting;Code Mystics;80.0;Fatal Fury: Mark of the Wolves, 가로우: 마크 오브 더 울브스, 餓狼 MARK OF THE WOLVES;Fatal Fury;26-02-2000;N/A;PC (Microsoft Windows), PlayStation 2, Xbox 360, Dreamcast, Android, iOS, PlayStation Vita, PlayStation 4, Arcade, Neo Geo MVS, Neo Geo AES
Vector;523;$6.99;0;Music;Nekki;70.0;Vector 1, Vector for iPhone;Vector;14-12-2013;N/A;PC (Microsoft Windows), Android, iOS, Ouya, Web browser
Fistful of Frags;522;$0.00;0;Shooter;Fistful of Frags Team;N/A;FoF;N/A;20-12-2007;Source;Linux, PC (Microsoft Windows), Mac
Tesla Effect;521;$19.99;0;Puzzle;Big Finish Games;68.5;Tex Murphy - Project Fedora, Tesla Effect: A Tex Murphy Adventure, Tex Murphy - Project Fedora;Tex Murphy;08-05-2014;N/A;PC (Microsoft Windows), Mac
Rival Stars Horse Racing;516;$39.99;0;Racing;PikPok;N/A;Rival Stars Horse Racing: Desktop Edition;N/A;24-06-2020;N/A;PC (Microsoft Windows)
Gun Done;516;$0.99;0;Indie;AZAMATIKA;N/A;Gun Done: COLOR PARADE;N/A;13-06-2016;N/A;PC (Microsoft Windows), iOS
