Game title;Amount of recommendations;Current price;Current discount;Genre;Publisher;Rating;Names;Collection;Release;engine;Platforms
BADLAND: Game of the Year Edition;1,688;$9.99;0;Platform;BlitWorks;66.66666666666667;バッドランド：ゲーム・オブ・ザ・イヤー・エディション;Badland;30-07-2015;N/A;Linux, PC (Microsoft Windows), PlayStation 3, Mac, Wii U, PlayStation Vita, PlayStation 4, Xbox One, Nintendo Switch
The Suicide of Rachel Foster;1,684;$17.99;0;Adventure;ONE-O-ONE GAMES;64.75;ザスーサイドゥオブレイチェルフォスター;N/A;19-02-2020;Unreal Engine;Linux, PC (Microsoft Windows), PlayStation 4, Xbox One, Nintendo Switch
Evoland 2;1,680;$19.99;0;Fighting;Shiro Games;78.33333333333333;Evoland 2: A Slight Case of Spacetime Continuum Disorder;Evoland;25-08-2015;Heaps.io;PC (Microsoft Windows), Mac, Android, iOS
Need for Speed™ Rivals;1,678;$19.99;0;Racing;Criterion Games;80.23076923076923;NFS Rivals, Need for Speed™ Rivals, NFS Rivals, ニード・フォー・スピード ライバルズ, ニード フォー スピード ライバルズ;Need for Speed;15-11-2013;Frostbite;PC (Microsoft Windows), PlayStation 3, Xbox 360, PlayStation 4, Xbox One
STAR WARS™: Dark Forces;1,673;$5.99;0;Shooter;LucasArts;66.0;Dark Forces 1;Star Wars: Jedi Knight;28-02-1995;Jedi;PC (Microsoft Windows), PlayStation, DOS, Mac
Postal 3;1,673;$11.99;0;Shooter;Akella;10.0;Postal 3, Postal 3;Postal;23-11-2011;Source;PC (Microsoft Windows)
IL-2 Sturmovik: 1946;1,672;$9.99;0;Shooter;1C: Maddox Games;90.0;IL-2 스터모빅: 1946;IL-2 Sturmovik;07-12-2006;N/A;PC (Microsoft Windows)
Trials Rising;1,668;$19.99;0;Platform;RedLynx;76.9;トライアルズ ライジング;Trials;26-02-2019;N/A;PC (Microsoft Windows), PlayStation 4, Xbox One, Nintendo Switch, Google Stadia
Tales of Vesperia: Definitive Edition;1,660;$49.99;0;Role-playing (RPG);Bandai Namco Studios;82.14285714285714;テイルズ オブ ヴェスペリア Remaster, Tales of Vesperia Remaster;Tales;11-01-2019;N/A;PC (Microsoft Windows), PlayStation 4, Xbox One, Nintendo Switch
Down To One;1,654;$0.99;0;Sport;Tiger Electronics;N/A;Electronic Jordan vs. Bird One on One, Electronic Jordan vs. Bird: One on One LCD Video Game;N/A;31-12-1989;N/A;Handheld Electronic LCD
KHOLAT;1,653;$19.99;0;Adventure;BlitWorks;66.0;KHOLAT -ディアトロフ峠の惨劇-, Kholat ディアトロフ峠の惨劇, Kholat(ホラート);N/A;10-06-2015;Unreal Engine;PC (Microsoft Windows), Mac, PlayStation 4, Xbox One, Nintendo Switch
Rise of the Triad;1,653;$14.99;0;Shooter;Apogee Software;66.5;Project Rogue, ROTT, Rise of the Triad 2, Rise of the Triad 2, ROTT;Rise of the Triad;31-07-2013;Unreal Engine 3;PC (Microsoft Windows)
X3: Terran Conflict;1,647;$15.99;0;Role-playing (RPG);Deep Silver;90.0;X3TC;X series;16-10-2008;N/A;PC (Microsoft Windows)
The Legend of Heroes: Trails in the Sky SC;1,645;$29.99;0;Role-playing (RPG);Nihon Falcom;80.0;英雄伝説 空の軌跡 SC, Eiyū Densetsu Sora no Kiseki SC, Eiyū Densetsu Sora no Kiseki SC (PSP), Eiyū Densetsu Sora no Kiseki SC: Kai HD EDITION (PS3), 英雄伝説 空の軌跡 SC Evolution (PS Vita), Eiyū Densetsu Sora no Kiseki SC Evolution (PS Vita), Eiyū Densetsu VI Sora no Kiseki SC, 英雄伝説VI 空の軌跡 SC, 英雄伝説 空の軌跡 SC: 改 HD EDITION (PS3), 英雄伝説 空の軌跡 SC (PSP), Eiyuu Densetsu: Sora no Kiseki SC;The Legend of Heroes: Trails;29-10-2015;N/A;PC (Microsoft Windows), PlayStation 3, PlayStation Portable, PlayStation Vita
12 Labours of Hercules II: The Cretan Bull;1,644;$2.99;0;Puzzle;Purple Hills;N/A;12 Подвигов Геракла II - Критский бык, 12 Labours of Hercules II, 12 Labours of Hercules 2, 12 Labours of Hercules II: The Cretan Bull - A Strategy Hero Quest Game, 12 úkolů pro Herkula 2: Býk z Kréty, Die 12 Aufgaben des Herkules 2: Der Stier von Kreta, Les 12 travaux d'Hercule : le taureau de Crète, 헤라클레스의 12 하인 -  크레타의 황소, 12 prac Heraklesa 2: Byk Kreteński, Двенадцать подвигов Геракла 2: Критский Бык, ヘラクレスの12の功業その2: クレータの牡牛, Hercules no 12 no Kougyou Sono 2: Crater no Oushi;12 Labours of Hercules;05-06-2015;N/A;Linux, PC (Microsoft Windows), Mac, Android, iOS, Nintendo Switch
Summer Memories;1,643;$19.99;0;Simulator;Dojin Otome;N/A;あまえんぼ, Pampered Boy;N/A;15-06-2020;N/A;PC (Microsoft Windows)
Sid Meier's Civilization IV;1,643;$7.49;-75%;Simulator;Firaxis Games;77.33333333333333;Sid Meier's Civilization 4: Colonization, Sid Meier's Civilization 4: Colonization;Civilization;22-09-2008;N/A;PC (Microsoft Windows), Mac
Sid Meier's Civilization IV;1,643;$7.49;-75%;Simulator;Firaxis Games;77.33333333333333;Sid Meier's Civilization 4: Colonization, Sid Meier's Civilization 4: Colonization;Civilization;22-09-2008;N/A;PC (Microsoft Windows), Mac
Zeno Clash;1,639;$9.99;0;Fighting;ACE Team;54.5;Zeno Clash 2, Zeno Clash 2;Zeno Clash;30-04-2013;N/A;PC (Microsoft Windows), PlayStation 3, Xbox 360
DEVOUR;1,636;$4.99;0;Indie;Straight Back Games;N/A;DEVOUR;N/A;28-01-2021;N/A;PC (Microsoft Windows), Mac
King's Bounty: The Legend;1,636;$6.99;0;Role-playing (RPG);Katauri Interactive;87.25;King's Bounty. Легенда о рыцаре;King's Bounty;04-04-2012;TheEngine;PC (Microsoft Windows), Mac
Forward to the Sky;1,635;$7.99;0;Puzzle;Animu Game;70.0;フォワード・トゥ・ザ・スカイ;N/A;25-02-2021;N/A;Linux, PC (Microsoft Windows), Mac, Nintendo Switch
Aokana - Four Rhythms Across the Blue;1,633;$34.99;0;Adventure;FILMIC NOVEL;N/A;Aokana EXTRA2S, 蒼の彼方のフォーリズム EXTRA2S, Ao no Kanata no Four Rhythm EXTRA2S, Aokana: Four Rhythms Across the Blue EXTRA2S;N/A;23-05-2023;N/A;Nintendo Switch
AXYOS;1,625;$4.99;0;Shooter;Axyos Games;N/A;AXYOS;N/A;05-09-2014;N/A;PC (Microsoft Windows)
Atelier Sophie: The Alchemist of the Mysterious Book;1,622;$29.99;0;Role-playing (RPG);Koei Tecmo Europe;76.0833333333333;ソフィーのアトリエ～不思議な本の錬金術士～, Sofii no Atorie ～Fushigina hon no Renkinjutsushi～, Atelier Sophie: The Alchemist of the Mysterious Book, Sophie no Atelier: Fushigi na Hon no Renkinjutsushi, 소피의 아틀리에 ~신비한 책의 연금술사~;Atelier: Mysterious;19-11-2015;N/A;PC (Microsoft Windows), PlayStation 3, PlayStation Vita, PlayStation 4
Knights of Pen and Paper 2;1,622;$7.99;0;Role-playing (RPG);Kyy Games;75.0;Knights of Pen and Paper 2;Knights of Pen and Paper;20-10-2015;N/A;Linux, PC (Microsoft Windows), Mac, PlayStation 4
Secret of Mana;1,617;$39.99;0;Role-playing (RPG);Square Enix;68.0;Seiken Densetsu 2 Secret of Mana, 聖剣伝説2 シークレット オブ マナ, Secret of Mana Remake, 성검전설2 Secret of Mana, 성검전설2;Mana;15-02-2018;PhyreEngine;PC (Microsoft Windows), PlayStation Vita, PlayStation 4
D4: Dark Dreams Don't Die;1,615;$14.99;0;Point-and-click;Access Games;78.875;Dark Dreams Don't Die, D4: Dark Dreams Don't Die - Season One;D4;19-09-2014;Unreal Engine;PC (Microsoft Windows), Xbox One
Cat Quest II;1,611;$8.99;-40%;Role-playing (RPG);PQube;78.33333333333333;Cat Quest 2, Cat Quest II: The Lupus Empire, キャットクエスト2;Cat Quest;24-09-2019;N/A;PC (Microsoft Windows), iOS, PlayStation 4, Xbox One, Nintendo Switch
Street Racing Syndicate;1,609;$0.89;-70%;Racing;KISS ltd;59.5;SRS;N/A;31-08-2004;N/A;PC (Microsoft Windows), PlayStation 2, Xbox, Nintendo GameCube
METAL SLUG;1,607;$7.99;0;Shooter;DotEmu;N/A;メタルスラッグ, Metal Slug 3D, Metal Slug: Super Vehicle-001;Metal Slug;31-12-1997;N/A;Linux, Wii, PC (Microsoft Windows), PlayStation, Mac, Sega Saturn, Android, iOS, Neo Geo MVS, Neo Geo AES, Neo Geo CD
eden*;1,605;$19.99;0;Platform;Enix America Corporation;N/A;46 Okunen Monogatari: Harukanaru Eden he , EVO: The Search for Eden , 46億年物語 はるかなるエデンへ, EVO: Search for Eden, 46 Okunen Monogatari: Harukanaru Eden e, 46 Okunen Monogatari – Harukanaru Eden e, EVO: The Search for Eden;E.V.O.;15-07-1993;N/A;Super Nintendo Entertainment System, Super Famicom
POSTAL Redux;1,603;$8.99;0;Shooter;Running with Scissors;59.25;Postal Redux;Postal;20-05-2016;Unreal Engine 4;Linux, PC (Microsoft Windows), PlayStation 4, Nintendo Switch
planetarian ~the reverie of a little planet~;1,599;$9.99;0;Adventure;Sekai Project;N/A;planetarian ～ちいさなほしのゆめ～, planetarian ~Chiisana Hoshi no Yume~, Planetarian ~The Reverie of a Little Planet~, planetarian ~the reverie of a little planet~;N/A;24-08-2006;Real Live;PC (Microsoft Windows), PlayStation 2, Android, PlayStation Portable, iOS, Legacy Mobile Device, Nintendo Switch
Battlestar Galactica Deadlock;1,596;$39.99;0;Strategy;Slitherine Ltd.;78.0;BATTLESTAR GALACTICA Deadlock;Battlestar Galactica;31-08-2017;Unity;PC (Microsoft Windows), PlayStation 4, Xbox One, Nintendo Switch
The Legend of Heroes: Trails of Cold Steel II;1,589;$39.99;0;Role-playing (RPG);NIS America;80.81818181818181;英雄伝説 閃の軌跡II, The Legend of Heroes: Sen no Kiseki II, Eiyuu Densetsu: Sen no Kiseki II;The Legend of Heroes: Trails;25-09-2014;N/A;PC (Microsoft Windows), PlayStation 3, PlayStation Vita, PlayStation 4
Ikaruga;1,588;$9.99;0;Shooter;Nicalis, Inc.;90.0;斑鳩 ;N/A;29-05-2018;N/A;PC (Microsoft Windows), Xbox 360, Nintendo GameCube, Dreamcast, Android, PlayStation 4, Arcade, Nintendo Switch
Little Big Workshop;1,587;$19.99;0;Simulator;Mirage Game Studios;74.66666666666667;リトル ビッグ ワークショップ;N/A;17-10-2019;N/A;PC (Microsoft Windows), Mac, Android, iOS, PlayStation 4, Xbox One, Nintendo Switch, Google Stadia
Over the Dream;1,586;$3.99;0;Puzzle;Nintendo;80.4;Mario & Luigi RPG 4: Dream Adventure, Mario and Luigi: Dream Team, Mario & Luigi: Dream Team Bros., Mario ando Ruiiji Aru Pii Jii Fou: Doriimu Adobenchaa, Mario & Luigi RPG 4: Dream Adventure, Mario and Luigi: Dream Team, Mario & Luigi: Dream Team Bros., マリオ&ルイージRPG4 ドリームアドベンチャー, 마리오&루이지 RPG 4: 드림 어드벤처;Mario & Luigi;12-07-2013;N/A;Nintendo 3DS
Moss;1,584;$29.99;0;Platform;Polyarc Games;84.75;MOSS: BOOK II, Moss: 제2권, Moss:第２巻;Moss;31-03-2022;N/A;SteamVR, PlayStation VR, Meta Quest 2, PlayStation VR2
SIMULACRA;1,584;$4.99;0;Role-playing (RPG);Wales Interactive;70.0;SIMULACRA;Simulacra;26-10-2017;N/A;PC (Microsoft Windows), Mac, Android, iOS, PlayStation 4, Xbox One, Nintendo Switch
INMOST;1,582;$12.74;-15%;Platform;Hidden Layer Games;80.0;인모스트, INMOST (インモスト), インモスト;N/A;11-10-2019;N/A;PC (Microsoft Windows), Mac, iOS, Nintendo Switch
DATE A LIVE: Rio Reincarnation;1,580;$39.99;0;Role-playing (RPG);Sting Entertainment;N/A;デート・ア・ライブ 凜緒リンカーネイション HD, Date A Live: Rio Reincarnation HD;Date A Live;12-10-2017;N/A;PC (Microsoft Windows), PlayStation 4
Retro City Rampage™ DX;1,580;$14.99;0;Shooter;Vblank Entertainment;90.0;Grand Theftendo, Retro City Rampage 486, Retro City Rampage DX+;Retro City Rampage;02-10-2014;N/A;Linux, Wii, PC (Microsoft Windows), PlayStation 3, Mac, Android, Nintendo 3DS, PlayStation Portable, iOS, PlayStation Vita, PlayStation 4, Nintendo Switch
F1 2012;1,578;$5.99;0;Racing;Codemasters Birmingham;76.5;Formula 1 2012Formula One 2012, Formula 1 2012, Formula One 2012, Formula 1 2012, Formula One 2012;F1;17-09-2012;Ego Engine;PC (Microsoft Windows), PlayStation 3, Xbox 360, Mac
Strider;1,577;$14.99;0;Platform;Capcom;N/A;Strider 2014, Strider Hiryu;Strider;31-12-1989;N/A;Nintendo Entertainment System
HELLGATE: London;1,572;$9.74;-25%;Shooter;Flagship Studios;70.0;헬게이트: 런던;N/A;31-10-2007;Havok Physics;PC (Microsoft Windows)
Megaquarium;1,572;$24.99;0;Simulator;Twice Circled;82.0;メガクアリウム;N/A;13-09-2018;N/A;Linux, PC (Microsoft Windows), Mac, PlayStation 4, Xbox One, Nintendo Switch
RAID: World War II;1,557;$19.99;0;Shooter;Starbreeze Studios;50.0;RAID: World War II;N/A;26-09-2017;Diesel;PC (Microsoft Windows), PlayStation 4, Xbox One
ULTIMATE HARDBASS DEFENCE;1,556;$1.99;0;Indie;Magnolia Art;N/A;ULTIMATE HARDBASS DEFENCE;N/A;12-04-2019;N/A;PC (Microsoft Windows)
Sky Force Anniversary;1,556;$9.99;0;Shooter;Infinite Dreams;77.0;Sky Force 2014;Sky Force;05-06-2014;Unity;Linux, PC (Microsoft Windows), PlayStation 3, Mac, Android, iOS, Wii U, PlayStation Vita, PlayStation 4, Xbox One, Nintendo Switch
Flotsam;1,554;$24.99;0;Adventure;Mark Wonnacott;N/A;flotsam;Candle's castle series;03-12-2017;Bitsy;Web browser
Devil May Cry 4;1,552;$19.99;0;Hack and slash/Beat 'em up;Capcom Production Studio 1;81.28571428571429;DMC4, Devil May Cry: Refrain, デビル メイ クライ4;Devil May Cry;05-02-2008;MT Framework;PC (Microsoft Windows), PlayStation 3, Xbox 360
EVERSPACE™ 2;1,549;$39.99;0;Shooter;Rockfish Games;87.5;EVERSPACE 2;N/A;06-04-2023;Unreal Engine 4;PC (Microsoft Windows)
Gal*Gun: Double Peace;1,547;$7.49;-75%;Shooter;Inti Creates;25.0;Gal*Gun: Double Peace, ぎゃる☆がん　だぶるぴーす;N/A;17-03-2022;N/A;Nintendo Switch
Guacamelee! 2;1,544;$19.99;0;Fighting;Drinkbox Studios;84.0;Guacamelee 2;Guacamelee!;21-08-2018;N/A;PC (Microsoft Windows), PlayStation 4, Xbox One, Nintendo Switch
Dungeon Siege 2;1,544;$6.99;0;Role-playing (RPG);Gas Powered Games;83.0;地牢围攻2;Dungeon Siege;16-08-2005;N/A;PC (Microsoft Windows)
UNDER NIGHT IN-BIRTH Exe:Late[cl-r];1,540;$24.99;0;Fighting;French Bread;80.0;UNICLR, アンダーナイトインヴァース エクセレイト クレア ;Under Night In-Birth;21-02-2020;N/A;PC (Microsoft Windows), PlayStation 4, Nintendo Switch
The Room VR: A Dark Matter;1,539;$29.99;0;Puzzle;Fireproof Games;83.33333333333333;The Room VR;The Room;26-03-2020;Unity 2019;Oculus VR, SteamVR, PlayStation VR, Oculus Quest
10,000,000;1,537;$4.99;0;Puzzle;EightyEightGames;80.0;10,000,000;N/A;15-01-2013;N/A;Linux, PC (Microsoft Windows), Mac, Android, iOS
Red Faction;1,537;$9.99;0;Shooter;THQ;80.5;红色派系2, RF2, Red Faction 2, Red Faction 2;Red Faction;09-04-2003;Geo-Mod;PC (Microsoft Windows), PlayStation 2, Xbox, Nintendo GameCube, PlayStation 4
Heroes of Might & Magic V: Tribes of the East;1,537;$9.99;0;Role-playing (RPG);Nival Interactive;60.0;英雄無敵5: 東方王朝 (資料片), Heroes of Might & Magic V: Dzikie Hordy, Heroes of Might and Magic V: Повелители Орды, Герои Меча и Магии V: Повелители Орды, HoMM V: Tribes of the East, Heroes of Might and Magic 5: Tribes of the East, Heroes of Might and Magic 5: Tribes of the East, HoMM V: TotE;Heroes of Might and Magic;12-10-2007;Silent Storm Engine;PC (Microsoft Windows)
GRANDIA II HD Remaster;1,535;$19.99;0;Role-playing (RPG);Game Arts;77.0;Grandia II Anniversary Edition, Grandia II: A.E.;Grandia;24-08-2015;N/A;PC (Microsoft Windows)
Arma: Cold War Assault;1,534;$4.99;0;Shooter;Bohemia Interactive Studio;N/A;Operation Flashpoint: Cold War Crisis, Operation Flashpoint;ArmA;14-03-2017;Real Virtuality;Linux, PC (Microsoft Windows), Mac
Kingdom Under Fire 2;1,533;$9.99;0;Real Time Strategy (RTS);Blueside;N/A;Kingdom Under Fire 2, Kingdom Under Fire 2;Kingdom Under Fire;14-11-2019;FAME Tech;PC (Microsoft Windows)
Memoria;1,532;$3.99;-90%;Point-and-click;Deep Silver;76.66666666666667;Das Schwarze Auge: Memoria, Memoria;Chains of Satinav;27-01-2021;Visionaire;PC (Microsoft Windows), Mac, PlayStation 4, Xbox One, Nintendo Switch, Xbox Series X|S
Cossacks: Back to War;1,532;$4.99;0;Real Time Strategy (RTS);GSC Game World;N/A;Казаки: Снова Война;Cossacks;17-10-2002;N/A;Linux, PC (Microsoft Windows)
Saviors;1,531;$1.99;0;Fighting;Capcom;N/A;Darkstalkers 3, Vampire Savior, Vampire Savior: World of Darkness;Darkstalkers;01-05-1997;N/A;Arcade
River City Girls;1,528;$29.99;0;Fighting;WayForward;65.0;River City Girls 0, 新 熱血硬派 くにおたちの挽歌: with River City Girls Extra, River City GiRLS ZERØ;River City Girls;14-02-2022;N/A;PC (Microsoft Windows), PlayStation 4, Xbox One, Nintendo Switch, PlayStation 5, Xbox Series X|S
Redeemer;1,528;$14.99;0;Hack and slash/Beat 'em up;Good Shepherd Entertainment;61.25;リディーマー 僧侶の怒り ;N/A;01-08-2017;N/A;PC (Microsoft Windows)
Tower of Time;1,523;$24.99;0;Real Time Strategy (RTS);Event Horizon;78.33333333333333;Tower of Time Final Edition;N/A;31-12-2018;Unity;Linux, PC (Microsoft Windows), iOS, PlayStation 4, Xbox One, Nintendo Switch
東方憑依華　～ Antinomy of Common Flowers.;1,522;$24.99;0;Fighting;SUNFISH Co., Ltd.;72.0;TH15.5, AoCF, Touhou Hyouibana ~ Antinomy of Common Flowers, 東方憑依華 ～ Antinomy of Common Flowers, Touhou Hyouibana ～ Antinomy of Common Flowers, 東方憑依華, Touhou 15.5;Touhou Project;05-01-2018;N/A;PC (Microsoft Windows), PlayStation 4, Nintendo Switch
Dead by Daylight: LEATHERFACE;1,518;$4.99;0;N/A;Behaviour Interactive;N/A;Dead by Daylight - Leatherface, Dead by Daylight: レザーフェイス;Dead by Daylight;14-09-2017;N/A;PC (Microsoft Windows), Xbox One, Nintendo Switch
Blacksad;1,517;$15.99;-60%;Puzzle;Ys Interactive;66.25;BLACKSAD: Under the Skin, BLACKSAD: Under the Skin;N/A;05-11-2019;Unity 2018;PC (Microsoft Windows), Mac, PlayStation 4, Xbox One, Nintendo Switch
Sparkle 2 Evo;1,517;$4.99;0;Simulator;Forever Entertainment S. A.;70.0;The Sparkle 2: Evo, The Sparkle 2: Evo, 進化のひみつ;N/A;31-03-2014;N/A;Linux, PC (Microsoft Windows), Mac, iOS, PlayStation 4, Windows Phone, Nintendo Switch
Halo: Combat Evolved Anniversary;1,511;$9.99;0;Shooter;Microsoft Studios;80.0;Halo CEA, Halo Anniversary, Halo HD, Halo CE HD;Halo;15-11-2011;Blam! Engine;PC (Microsoft Windows), Xbox 360, Xbox One
Fragmented;1,506;$9.99;0;Puzzle;Mediascape;N/A;Story of the Star Fragment: Single Fragment Version, 星の欠片の物語、ひとかけら版, Hoshi no Kakera no Monogatari: Hitokakera-Ban;N/A;26-01-2018;N/A;PC (Microsoft Windows), PlayStation VR
The Swords of Ditto: Mormo's Curse;1,504;$14.99;0;Role-playing (RPG);onebitbeyond;70.0;ザソーズオブディトウエムオアエムオズカース;N/A;24-04-2019;N/A;PC (Microsoft Windows), PlayStation 4, Nintendo Switch
Panzer Corps;1,502;$29.99;0;Strategy;The Slitherine Group;81.0;Panzer Corps - Wehrmacht;N/A;12-03-2014;N/A;PC (Microsoft Windows), Mac, iOS
The Legend of Heroes: Trails of Cold Steel III;1,497;$59.99;0;Role-playing (RPG);Nihon Falcom;83.5;Eiyuu Densetsu: Sen no Kiseki III, THE LEGEND OF HEROES: 閃の軌跡Ⅲ, Trails of Cold Steel III, CS3, 英雄伝説 閃の軌跡Ⅲ, 영웅전설 섬의 궤적Ⅲ;The Legend of Heroes: Trails;28-09-2017;PhyreEngine;PC (Microsoft Windows), PlayStation 4, Nintendo Switch, Google Stadia
Old Man's Journey;1,491;$7.99;0;Puzzle;Broken Rules;N/A;おじいちゃんの記憶を巡る旅;N/A;18-05-2017;Unity;PC (Microsoft Windows), Mac, Android, iOS, PlayStation 4, Xbox One, Nintendo Switch
Total War: THREE KINGDOMS - Eight Princes;1,485;$8.99;0;Strategy;CREATIVE ASSEMBLY;N/A;Total War: THREE KINGDOMS - Eight Princes;N/A;08-08-2019;N/A;PC (Microsoft Windows)
hack_me;1,485;$3.99;0;Role-playing (RPG);CyberConnect2;N/A;.Hack: Part1, .hack//INFECTION - Part 1, .hack//Liminality, .hack//Infection Expansion, dotHACK Part 1, .hack//感染拡大Vol.1, .hack//Infection;Project .Hack;20-06-2002;N/A;PlayStation 2
The Survivalists;1,481;$24.99;0;Role-playing (RPG);Team17;60.0;サバイバリスト;N/A;09-10-2020;N/A;PC (Microsoft Windows), PlayStation 4, Xbox One, Nintendo Switch
Ys II;1,479;$14.99;0;Role-playing (RPG);Nihon Falcom;N/A;イースII;Ys;25-05-1990;N/A;Family Computer
Dungeon Siege III;1,478;$14.99;0;Role-playing (RPG);Obsidian Entertainment;76.16666666666667;Dungeon Siege 3, ダンジョン シージ ３;Dungeon Siege;17-06-2011;Onyx Engine;PC (Microsoft Windows), PlayStation 3, Xbox 360
DISTRAINT 2;1,476;$8.99;0;Puzzle;Jesse Makkonen;N/A;ドットホラーストーリー２;DISTRAINT;13-11-2018;Clickteam Fusion;PC (Microsoft Windows), Android, iOS, PlayStation 4, Xbox One, Nintendo Switch
Enclave;1,475;$4.99;0;Role-playing (RPG);Conspiracy Games;81.0;困土, Enclave: Shadows of Twilight;N/A;10-03-2002;Starbreeze Engine;Wii, PC (Microsoft Windows), Xbox
The Dark Eye: Chains of Satinav;1,470;$19.99;0;Point-and-click;Deep Silver;N/A;The Dark Eye: Klątwa Wron, Das Schwarze Auge: Satinavs Ketten;Chains of Satinav;22-06-2012;Visionaire;PC (Microsoft Windows), Mac, PlayStation 4, Xbox One, Nintendo Switch, Xbox Series X|S
Crimsonland;1,466;$13.99;0;Shooter;10tons;60.75;Crimson Land;N/A;11-06-2014;N/A;Linux, PC (Microsoft Windows), PlayStation 3, Mac, Android, PlayStation Vita, PlayStation 4, Xbox One, Nintendo Switch, PlayStation 5
ScourgeBringer;1,457;$11.89;-30%;Fighting;Dear Villagers;72.5;스커지브링어, スカージブリンガー;N/A;21-10-2020;N/A;Linux, PC (Microsoft Windows), Mac, PlayStation Vita, PlayStation 4, Xbox One, Nintendo Switch, PlayStation 5
Despair;1,456;$0.99;0;Platform;Konami;68.33333333333333;悪魔城ドラキュラ ハーモニー オブ ディスペアー, Devil's Castle Dracula: Harmony of Despair, Devil's Castle Dracula: Harmony of Despair, Akumajou Dracula: Harmony of Despair, Castlevania HD, 캐슬베니아:하모니 어브 데스페어, 캐슬베니아: 하모니 어브 데스페어;Castlevania;27-09-2011;N/A;PlayStation 3, Xbox 360
Volgarr the Viking;1,456;$9.99;0;Platform;Adult Swim Games;80.0;Völgarr the Viking, バイキングをVolgarr;N/A;16-11-2016;N/A;Linux, PC (Microsoft Windows), Mac, Wii U, PlayStation Vita, PlayStation 4, Xbox One, Nintendo Switch
Boundless;1,455;$39.99;0;Role-playing (RPG);Wonderstruck Games;80.0;Oort Online;N/A;11-09-2018;Turbulenz Engine;PC (Microsoft Windows), Mac, PlayStation 4
Neverending Nightmares;1,455;$14.99;0;Adventure;Infinitap Games;67.0;ネバーエンディングナイトメア;N/A;26-09-2014;N/A;Linux, PC (Microsoft Windows), Mac, PlayStation Vita, PlayStation 4, Ouya, Nintendo Switch
The Golf Club™ 2019 Featuring PGA TOUR;1,453;$9.99;-80%;Simulator;HB Studios;69.25;The Golf Club 2019, The Golf Club 2019 Featuring the PGA Tour;The Golf Club;28-08-2018;N/A;PC (Microsoft Windows), PlayStation 4, Xbox One
Lost Planet 3;1,453;$24.99;0;Shooter;Capcom;57.66666666666666;ロストプラネット 3;Lost Planet;27-08-2013;Unreal Engine;PC (Microsoft Windows), PlayStation 3, Xbox 360, Xbox One
A Normal Lost Phone;1,452;$2.99;0;Puzzle;Plug In Digital;88.0;ANLP;N/A;26-01-2017;N/A;Linux, PC (Microsoft Windows), Mac, Android, iOS, Nintendo Switch
DOOM VFR;1,450;$29.99;0;Shooter;Bethesda Softworks;75.0;DOOM VFR;Doom;21-12-2017;N/A;Windows Mixed Reality, SteamVR, PlayStation VR
Vanguard Princess;1,448;$4.99;0;Fighting;Tomoaki Sugeno;N/A;ヴァンガードプリンセス, Vanguard Princess;N/A;26-06-2009;2D Fighter Maker 2nd.;PC (Microsoft Windows)
Teslagrad;1,448;$9.99;0;Platform;Snow Cannon Games;79.33333333333333;テスラグラッド;Teslagrad;13-12-2013;Unity;Linux, PC (Microsoft Windows), PlayStation 3, Mac, Android, Wii U, PlayStation Vita, PlayStation 4, Xbox One, Nintendo Switch
The Banner Saga 3;1,447;$24.99;0;Role-playing (RPG);Stoic;87.0;Banner Saga 3, Banner Saga 3;The Banner Saga;31-12-2018;The Banner Saga Engine;PC (Microsoft Windows), Mac, Android, iOS, PlayStation 4, Xbox One, Nintendo Switch
Phoenix Point;1,445;$59.99;0;Role-playing (RPG);Snapshot Games;82.0;피닉스 포인트;N/A;03-12-2019;Unity;PC (Microsoft Windows), Xbox One, PlayStation 5, Google Stadia
The Drone Racing League Simulator;1,444;$9.99;0;Racing;The Drone Racing League;N/A;DRL Simulator, Drone Racing League Simulator;N/A;23-09-2020;N/A;PC (Microsoft Windows), PlayStation 4, Xbox One
Tempest;1,443;$14.99;0;Shooter;Interplay;80.0;Tempest X3: An Inter-Galactic Battle Zone, Tempest 2000 Playstation, Tempest 2K PS1, Tempest X₃, Temptest X3;Tempest;01-02-1997;N/A;PlayStation
X-Morph: Defense;1,441;$19.99;0;Shooter;Exor Studios;81.75;エックスモーフ：ディフェンス;N/A;30-08-2017;N/A;PC (Microsoft Windows), PlayStation 4, Xbox One, Nintendo Switch
Grand Ages: Medieval;1,439;$19.99;0;Real Time Strategy (RTS);Kalypso Media Digital;65.0;グランド エイジ メディーバル;N/A;25-09-2015;N/A;Linux, PC (Microsoft Windows), Mac, PlayStation 4
Hero of the Kingdom II;1,437;$7.99;0;Point-and-click;Lonely Troops;N/A;Hero of the Kingdom 2;Hero of the Kingdom;20-02-2015;N/A;Linux, PC (Microsoft Windows), Mac
Team Sonic Racing™;1,435;$39.99;0;Racing;Sumo Digital;71.33333333333333;チームソニックレーシング;N/A;21-05-2019;N/A;PC (Microsoft Windows), PlayStation 4, Xbox One, Nintendo Switch
Hitman: Contracts;1,433;$8.99;0;Shooter;IO Interactive;70.0;Hitman Contracts;Hitman;20-04-2004;Glacier;PC (Microsoft Windows), PlayStation 2, Xbox, Mac
Uplink;1,430;$9.99;0;Simulator;Introversion Software;70.0;Uplink: Hacker Elite;N/A;01-10-2001;N/A;Linux, PC (Microsoft Windows), Mac, Android, iOS
Receiver 2;1,429;$19.99;0;Shooter;Wolfire Games;N/A;Receiver II;Receiver;14-04-2020;N/A;Linux, PC (Microsoft Windows), Mac
planetarian HD;1,429;$9.99;0;Simulator;Visual Arts;N/A;planetarian HD Edition, planetarian HDエディション;N/A;08-05-2017;Real Live;PC (Microsoft Windows)
DYSMANTLE;1,427;$15.59;-22%;Puzzle;10tons Ltd.;83.0;DYSMANTLE;N/A;16-11-2021;N/A;Linux, PC (Microsoft Windows), Mac, iOS, PlayStation 4, Xbox One, Nintendo Switch, PlayStation 5, Xbox Series X|S
BERSERK and the Band of the Hawk;1,426;$59.99;0;Hack and slash/Beat 'em up;Koei Tecmo Games;66.57142857142857;BERSERK, Berserk Musou, ベルセルク無双;Berserk;21-02-2017;N/A;PC (Microsoft Windows), PlayStation 3, PlayStation Vita, PlayStation 4
The Complex;1,417;$12.99;0;Shooter;G-artists, Production I.G, Inc.;N/A;攻殻機動隊 STAND ALONE COMPLEX -狩人の領域-, Kokaku Kidotai: Stand Alone Complex - Domain of the Hunters, Ghost in the Shell: Stand Alone Complex PSP;Ghost in the Shell;26-10-2005;N/A;PlayStation Portable
